<Genproc>|2012-12-25|11:50:06|0|0|1|1|0|0|0|0|0|0|1|0|0|1|0|0|Зам. Генпрокурора РФ Юрий Пономарёв потребовал привлечь к ответственности начальника управления УРЦ МЧС России http://t.co/th2JOzdh |России
<Genproc>|2012-12-25|11:51:47|0|0|0|1|0|0|0|0|0|0|2|0|0|3|0|0|В Якутии по материалам прокурорской проверки возбуждено уголовное дело о хищении более 2 млн. р. из бюджета республики http://t.co/Mpui3uzN |Якутии
<Genproc>|2012-12-25|11:52:56|0|0|0|1|0|0|0|0|0|0|2|0|0|4|0|0|В Свердловской области председатель общества инвалидов обвиняется в получении денег от граждан якобы на взятки http://t.co/xfc9fjuR |Свердловской области
<Genproc>|2012-12-25|11:54:36|0|1|0|0|0|0|0|1|0|0|0|0|0|3|0|0|В Приморье на 1 млн. рублей оштрафована фирма, в интересах которой было совершено коррупционное преступление http://t.co/AoqeG1DF 
<Genproc>|2012-12-25|12:24:07|0|0|0|1|0|0|0|0|0|0|0|0|0|2|0|0|В Красноярском крае в результате принятых мер реагирования работникам транспортной компании выплачен долг по зарплате http://t.co/EVRk41Lr |Красноярском
<Genproc>|2012-12-25|12:25:39|1|0|0|1|0|0|0|0|0|0|1|0|0|3|0|0|В Хакасии прокуратура в суде отстояла право матери на получение компенсации, связанной с гибелью сына http://t.co/dui64AIl |Хакасии
<Genproc>|2012-12-25|12:43:06|0|0|0|1|0|0|0|0|0|0|0|0|0|2|0|0|Во Владимирской области в суд направлено уголовное дело о подпольном казино http://t.co/ibMCZ6tH |Владимирской области
<Genproc>|2012-12-25|12:44:15|0|0|0|3|0|0|0|0|0|0|0|0|1|4|0|0|Направлено в суд уголовное дело о разбойных нападениях на склады в Московской, Калужской областях и в г. Москве http://t.co/y8vEIbk6 |Московской области|Калужской области|Москве
<Genproc>|2012-12-25|13:09:18|0|0|0|0|0|0|0|0|0|0|0|0|0|2|0|0|На Чукотке прокуратура помогает жителю с. Тавайваам, вынужденному проживать у разных людей более 4 лет, получить жилье http://t.co/401lhfus 
<Genproc>|2012-12-25|14:00:33|0|0|0|0|0|0|0|0|0|0|0|0|0|1|0|0|Прокуратура Оренбуржья принимает меры к обеспечению бесперебойного теплоснабжения объектов МО РФ http://t.co/fb93Kx0W 
<Genproc>|2012-12-25|14:45:15|0|0|0|1|0|0|0|0|0|0|0|0|0|0|0|0|В Новосибирске осуждены участники банды «Трунова» http://t.co/HmjMnjMY |Новосибирске
<Genproc>|2012-12-25|14:56:58|0|0|0|0|0|0|0|0|0|0|0|0|1|1|0|0|Прокуроры субъектов разместили на своих официальных сайтах сегменты сводного плана проверок на 2013 г. http://t.co/5ml48gBY 
<Genproc>|2012-12-25|15:42:24|0|0|0|1|0|0|0|0|0|0|0|0|0|2|0|0|В Амурской области глава Поярковского сельсовета по инициативе прокурора отстранена от должности http://t.co/PHEjb1zW |Амурской области
<Genproc>|2012-12-25|15:51:52|0|0|0|1|0|0|0|0|0|0|1|0|0|1|0|0|В Тамбовской области прокуратура защитила право ветерана Великой Отечественной войны на улучшение жилищных условий http://t.co/vajFijbW |Тамбовской области
<Genproc>|2012-12-25|16:05:07|0|0|0|0|0|0|0|0|0|0|0|0|0|2|0|0|Прокуратура ЯНАО добилась признания недействительным диплома и отмены приказов о присвоении званий полицейскому http://t.co/iSDU3Wpb 
<Genproc>|2012-12-25|16:30:09|0|0|0|1|0|0|0|0|0|0|0|0|0|3|0|0|В Ростове-на-Дону по материалам прокуроров возбуждено дело о хищении средств для закупки снегоуборочной тежники http://t.co/lW7fq7ZA |Ростове-на-Дону
<Genproc>|2012-12-25|16:50:53|0|0|0|1|0|0|0|0|0|0|0|0|0|2|0|0|Управление ГП РФ в СКФО вскрыло в Карачаево-Черкесии факты незаконного расходования денег для станции переливания крови http://t.co/ORvE9867 |Карачаево-Черкесии
<Genproc>|2012-12-25|17:05:48|0|0|0|1|0|0|0|0|0|0|0|0|0|1|0|0|Суд по требованию прокуратуры обязал администрацию Забайкальского района организовать подвоз учащихся http://t.co/gVWtVcn3 |Забайкальского края
<Genproc>|2012-12-25|17:06:55|0|0|0|1|0|0|0|1|0|0|0|0|0|4|0|0|В Омске направлено в суд уголовное дело о незаконном обороте алкогольной продукции на сумму около 4 миллионов рублей http://t.co/nHUs2N3k |Омске
<Genproc>|2012-12-25|17:08:35|0|0|0|0|0|0|0|0|0|0|0|0|1|1|0|0|Прокуроры субъектов разместили на своих официальных сайтах сегменты сводного плана проверок на 2013 г. http://t.co/A3yRudKc 
<Genproc>|2012-12-26|09:40:18|0|0|0|1|0|0|0|0|0|0|0|0|0|0|0|0|О модернизации интернет-представительства Генеральной прокуратуры Российской Федерации http://t.co/AoSnaO2h |Российской Федерацией
<Genproc>|2012-12-26|10:40:37|0|0|0|0|0|0|0|0|0|0|0|0|0|2|0|0|В ЮФО в рамках работы прокуратуры по противодействию незаконной игорной деятельности изъято более 5 тыс. оборудований http://t.co/2svUe7Ha 
<Genproc>|2012-12-26|11:39:07|0|0|0|1|0|0|0|0|0|0|0|0|0|3|0|0|В Приморье перед судом предстанет студент ВУЗа за организацию контрабанды наркотических средств на территорию России http://t.co/5o4QFT5H |России
<Genproc>|2012-12-26|11:46:41|0|0|0|1|0|0|0|0|0|0|0|0|0|3|0|0|В Архангельской области в суд направлено уголовное дело о хищениях в деревнях старинных предметов и икон http://t.co/ubP55ZDm |Архангельской области
<Genproc>|2012-12-26|11:47:45|0|0|0|1|0|0|0|0|0|0|0|0|0|1|0|0|В Новосибирской области прокуратура принимает меры к обеспечению надлежащим жильем сирот http://t.co/T44UY3yX |Новосибирской области
<Genproc>|2012-12-26|11:47:55|0|0|0|1|0|0|0|0|0|0|0|0|0|1|0|0|В Свердловской области перед судом предстанет заказчик убийства депутата муниципалитета http://t.co/jSnKWXFW |Свердловской области
<Genproc>|2012-12-26|11:49:22|0|0|0|1|0|0|0|0|0|0|0|0|0|1|0|0|В Иркутской области главному бухгалтеру предприятия за дачу взятки налоговому инспектору назначен 15-милионный штраф http://t.co/6oh2BFkg |Иркутской области
<Genproc>|2012-12-26|11:53:21|0|0|0|0|0|0|0|0|0|0|0|0|0|1|0|0|В УрФО в суд направлено уголовное дело в отношении участника организованной преступной группы http://t.co/jUqMJaub 
<Genproc>|2012-12-26|12:39:46|0|0|0|1|0|0|0|0|0|0|0|0|0|2|0|0|В Ульяновской области перед судом предстанет предприниматель, организовывавший аферы с материнским капиталом http://t.co/btyzydo0 |Ульяновской области
<Genproc>|2012-12-26|12:42:48|0|0|0|1|0|0|0|0|0|0|0|0|1|1|0|0|По заявлению прокуратуры признано незаконным бездействие администрации г. Твери в сфере дорожной деятельности http://t.co/1lcMTm71 |Твери
<Genproc>|2012-12-26|12:45:04|0|0|0|1|0|0|1|0|0|0|0|0|0|1|0|0|В Волгоградской области суд обязал предприятие, эксплуатирующее ЛЭП, оборудовать их птицезащитными устройствами http://t.co/t84rmkdN |Волгоградской области
<Genproc>|2012-12-26|12:46:08|0|0|0|1|0|0|0|0|0|0|0|0|1|1|0|0|Прокуратура столицы внесла представление в адрес Территориального управления Росимущества в г. Москве http://t.co/AGiXKrgP |Москве
<Genproc>|2012-12-26|12:47:27|0|0|0|0|0|0|0|0|0|0|0|0|0|2|0|0|Главная военная прокуратура выявила нарушения при заключении государственного контракта на обслуживание зданий http://t.co/8t4FjB8F 
<Genproc>|2012-12-26|12:49:13|0|0|0|0|0|0|0|0|0|0|0|0|1|1|0|0|Прокуроры субъектов разместили на своих официальных сайтах сегменты сводного плана проверок на 2013 г. http://t.co/3Nks9xZL 
<Genproc>|2012-12-26|14:00:01|0|0|0|1|0|0|0|0|0|0|0|0|0|1|0|0|В Самарской области возбуждено уголовное дело в отношении бывшего следователя регионального управления СК РФ http://t.co/i1IcpDKx |Самарской области
<Genproc>|2012-12-26|14:02:44|0|0|0|1|0|0|0|0|0|0|0|0|0|1|0|0|В Челябинской обл в суд направлено уголовное дело в отношении лиц, обвиняемых в содействии террористической организации http://t.co/M5oTQY34 |Челябинской области
<Genproc>|2012-12-26|15:24:55|0|0|0|1|0|0|0|0|0|0|0|0|1|2|0|0|Сегодня в Хабаровске состоялось совещание по итогам работы управления Генеральной прокуратуры в ДФО в 2012 г. http://t.co/m2MEbDLX |Хабаровске
<Genproc>|2012-12-26|15:36:06|0|0|0|1|0|0|0|0|0|0|0|0|0|1|0|0|В Волгоградской области суд по иску прокурора обязал администрацию городского поселения обеспечить население водой http://t.co/73xJJvez |Волгоградской области
<Genproc>|2012-12-26|15:37:45|0|0|0|1|0|0|0|0|0|0|0|0|1|0|0|0|В г. Санкт-Петербурге прокуратура объявила предостережения  руководителям 13 организаций-перевозчиков http://t.co/HcQ7EvW4 |Санкт-Петербурге
<Genproc>|2012-12-26|15:38:41|0|0|0|1|0|0|0|0|0|0|0|0|0|2|0|0|В Калужской области по результатам прокурорской проверки возбуждено уголовное дело о халатности http://t.co/y6iHDGB8 |Калужской области
<Genproc>|2012-12-26|15:40:24|0|0|0|0|0|0|0|0|0|0|0|0|1|1|0|0|Прокуроры субъектов разместили на своих официальных сайтах сегменты сводного плана проверок на 2013 г. http://t.co/5Q3sFPg5 
<Genproc>|2012-12-26|16:17:30|0|0|0|1|0|0|0|0|0|0|1|0|0|2|0|0|Директор Тесинского детского дома в Красноярском крае привлечена к ответственности http://t.co/dXoBBC5x |Красноярском
<Genproc>|2012-12-26|16:34:04|0|0|0|1|0|0|0|0|0|0|0|0|0|1|0|0|В Курганской области бывший генеральный директор «Курортов Зауралья» осужден за присвоение денежных средств предприятия http://t.co/kKBcLXjW |Курганской области
<Genproc>|2012-12-26|16:34:22|0|0|0|0|0|0|0|0|0|0|1|0|0|1|0|0|По постановлениям заместителя Генпрокурора РФ чиновники Департамента Росприроднадзора привлечены к ответственности http://t.co/DFyUwSRN 
<Genproc>|2012-12-26|16:51:12|0|0|0|0|0|0|0|0|0|0|1|0|0|0|0|0|В Оренбуржье осуждены бывшие сотрудники полиции, насмерть забившие задержанного гражданина http://t.co/03ODtnKf 
<Genproc>|2012-12-26|17:18:00|0|0|0|1|0|0|0|0|0|0|0|0|0|1|0|0|В Ленинградской области заведующая центром социального обслуживания осуждена за должностные преступления http://t.co/g1psulQM |Ленинградской области
<Genproc>|2012-12-26|17:19:21|0|0|0|1|0|0|0|0|0|0|0|0|0|2|0|0|По требованию прокуратуры Республики Коми сельским педагогам региона вернут льготы по оплате за жилье http://t.co/bQZxFGVm |Коми
<Genproc>|2012-12-26|17:31:55|0|0|0|1|0|0|0|0|0|0|1|0|0|2|0|0|Прокуратура Псковской области принимает меры по установлению эффективного надзора за соблюдением прав предпринимателей http://t.co/V1cz5vEL |Псковской области
<Genproc>|2012-12-27|10:24:28|0|0|0|1|0|0|0|0|0|0|0|1|0|1|0|0|Генеральная прокуратура РФ направила в суд уголовное дело в отношении бывшего губернатора Тульской области http://t.co/InhoseCt |Тульской области
<Genproc>|2012-12-27|10:41:32|0|0|0|1|0|0|0|0|0|0|0|0|0|0|0|0|В Республике Дагестан осуждены участники «Избербашской» вооружённой группировки http://t.co/dlZzZNfp |Дагестан
<Genproc>|2012-12-27|11:45:38|0|0|0|1|0|0|0|0|0|0|0|0|0|2|0|0|В Республике Башкортостан спустя 75 лет отменено решение тройки НКВД БАССР, осудившей невиновное лицо к расстрелу http://t.co/joIq6Niu |Башкортостан
<Genproc>|2012-12-27|11:49:21|0|0|0|1|0|0|0|1|0|0|0|0|0|1|0|0|В Пермском крае директор управляющей компании осужден за хищение более 2 млн. рублей бюджетных средств http://t.co/MdJ7cIWm |Пермском крае
<Genproc>|2012-12-27|11:51:37|0|0|0|1|0|0|0|0|0|0|1|0|0|3|0|0|В Мордовии глава села оштрафована за нарушения законодательства о размещении заказов для муниципальных нужд http://t.co/obwH1wy4 |Мордовии
<Genproc>|2012-12-27|12:01:57|0|0|0|2|0|0|0|0|0|0|2|0|0|4|0|0|В Израиль экстрадирован гражданин этого государства, который совершил побег из тюрьмы и скрывался на территории России http://t.co/vHZjJNlW |Израиль|России
<Genproc>|2012-12-27|12:03:15|0|0|0|1|0|0|0|0|0|0|0|0|0|2|0|0|В Красноярском крае по требованию прокуратуры в школы куплены учебники http://t.co/CtLaQ4kY |Красноярском
<Genproc>|2012-12-27|12:32:45|0|0|0|1|0|0|0|0|0|0|0|0|0|1|0|0|В Северной Осетии-Алании благодаря прокурорскому вмешательству школы обеспечены бесплатными учебниками http://t.co/5YmZDAVl |Северной Голландией
<Genproc>|2012-12-27|12:34:27|0|0|0|1|0|0|0|1|0|0|0|0|0|3|0|0|В Санкт-Петербурге за незаконную организацию азартных игр 32 организации оштрафованы более чем на 14 млн. рублей http://t.co/kSvEMNQx |Санкт-Петербурге
<Genproc>|2012-12-27|12:36:02|0|0|0|1|0|0|0|1|0|0|0|0|0|3|0|0|В Адыгее вынесен приговор по уголовному делу о хищении 42,5 млн. рублей, выделенных на развитие сельского хозяйства http://t.co/GT7dBc9O |Адыгее
<Genproc>|2012-12-27|12:46:48|0|0|0|1|0|0|0|0|0|0|0|0|1|2|0|0|Прокурор г. Магадана добился производства ремонта в жилых помещениях, предоставленных лицам из числа детей-сирот http://t.co/MFTTMkSa |Магадана
<Genproc>|2012-12-27|12:48:17|0|0|0|1|0|0|0|0|0|0|0|0|0|2|0|0|В Кемеровской области по материалам прокурорской проверки возбуждено 9 уголовных дел о хищении бюджетных средств http://t.co/XnGQmHSE |Кемеровской области
<Genproc>|2012-12-27|12:52:13|0|0|0|1|0|0|0|0|0|0|0|0|1|1|0|0|Прокуратура г. Москвы направила в следственные органы результаты исследования личной интернет-страницы Виноградова http://t.co/MNhDpco0 |Москвы
<Genproc>|2012-12-27|13:20:32|0|0|0|1|0|0|0|0|0|0|0|0|0|2|0|0|По иску прокурора Амурской области в собственность города из незаконного владения возвращен земельный участок http://t.co/TN5M7eBc |Амурской области
<Genproc>|2012-12-27|13:25:11|0|0|0|1|0|0|0|0|0|0|0|0|0|2|0|0|В Татарстане благодаря прокуратуре участок земли, незаконно бывший в частной собственности, передан многодетной семье http://t.co/l8vuB62K |Татарстане
<Genproc>|2012-12-27|13:27:35|0|0|0|1|0|0|0|0|0|0|0|0|0|3|0|0|В Карелии прокуратура направила в суд уголовное дело о хищении средств, выделенных на покупку жилья вдове ветерана ВОВ http://t.co/HhcpNzFC |Карелии
<Genproc>|2012-12-27|14:08:28|0|0|0|1|0|0|0|0|0|0|0|0|0|2|0|0|В Москве направлено в суд уголовное дело в отношении участника «медведковской» и «ореховской» банд http://t.co/9KxW2hL8 |Москве
<Genproc>|2012-12-27|15:15:28|0|0|0|1|0|0|0|0|0|0|0|0|0|1|0|0|В Свердловской области вынесен приговор «черным риэлторам», убивавшим пожилых людей из-за квартир http://t.co/G00SUjdu |Свердловской области
<Genproc>|2012-12-27|15:18:23|0|0|0|1|0|0|0|0|0|0|1|0|0|1|0|0|Зам.Генпрокурора РФ Юрий Гулягин объявил предостережение о недопустимости нарушения закона главе Хабаровского района http://t.co/YCKbAPYo |Хабаровского края
<Genproc>|2012-12-27|15:21:37|1|0|0|0|0|0|0|0|0|0|0|0|0|3|0|0|Житель Ленобласти осужден за развратные действия в отношении несовершеннолетней с использованием соцсети "ВКонтакте" http://t.co/HGgpfPD9 
<Genproc>|2012-12-27|15:24:45|0|0|0|1|0|0|0|0|0|0|1|0|0|0|0|0|По требованию прокуратуры Волгоградской области 2 теплогенерирующие компании признаны нарушившими антимонопольный закон http://t.co/3cnycNjt |Волгоградской области
<Genproc>|2012-12-27|15:26:42|0|0|0|1|0|0|0|1|0|0|0|0|0|2|0|0|В Вологодской области направлено в суд дело о растрате двумя руководителями управляющих компаний более 45 млн. рублей http://t.co/YaY3TmxK |Вологодской области
<Genproc>|2012-12-27|15:27:33|0|0|0|0|0|0|0|0|0|0|0|0|0|2|0|0|Ямало-Ненецкая природоохранная прокуратура принимает меры к обеспечению законности в деятельности нефтяной компании http://t.co/JQQHjJVS 
<Genproc>|2012-12-27|15:30:25|0|0|0|0|0|0|0|0|0|0|0|0|0|1|0|0|Замгенпрокурора РФ С. Воробьев направил в суд уголовное дело в отношении участника ОПГ, занимавшейся вымогательством http://t.co/73WN2iQW 
<Genproc>|2012-12-27|15:35:37|0|0|0|0|0|0|0|0|0|0|0|0|0|2|0|0|По результатам прокурорской проверки в ФБУ «Подводречстрой» возбуждено уголовное дело по факту многомиллионного долга http://t.co/2MdgeFkR 
<Genproc>|2012-12-27|15:38:26|0|0|0|1|0|0|0|0|0|0|0|0|0|2|0|0|Прокуратура Красноярского края направила в суд уголовное дело о незаконном использовании компьютерных программ http://t.co/OWimBVF0 |Красноярского края
<Genproc>|2012-12-27|15:39:32|0|0|0|1|0|0|0|0|0|0|0|0|0|2|0|0|Прокуратура Красноярского края направила в суд уголовное дело о незаконном использовании компьютерных программ http://t.co/h3gSIsti |Красноярского края
<Genproc>|2012-12-27|15:40:46|0|0|0|1|0|0|0|0|0|0|0|0|1|2|0|0|Прокуратура г. Москвы направила в суд уголовные дела об организации незаконных азартных игр http://t.co/BmocEw9W |Москвы
<Genproc>|2012-12-27|16:11:34|0|0|0|1|0|0|0|0|0|0|0|0|0|2|0|0|В Татарстане перед судом предстанет сотрудник полиции, укрывавший преступления от учета http://t.co/j4uEYViP |Татарстане
<Genproc>|2012-12-27|17:02:14|0|0|0|1|0|0|0|0|0|0|0|0|0|1|0|0|Экс-начальник управления здравоохранения Курганской области осуждена за превышение должностных полномочий http://t.co/Htr0TUMf |Курганской области
<Genproc>|2012-12-27|17:09:41|0|0|0|1|0|0|0|0|0|0|0|0|0|3|0|0|Генеральная прокуратура Российской Федерации направила в суд уголовное дело о покушении на сбыт более 10 кг гашиша http://t.co/dMa5fUVW |Российской Федерацией
<Genproc>|2012-12-27|17:26:02|0|0|0|0|0|0|0|0|0|0|0|0|0|1|0|0|Зам.Генпрокурора РФ Иван Сыдорук направил в суд уголовное дело в отношении жителя Кабардино-Балкарской Республики http://t.co/DkM7f9WM 
<Genproc>|2012-12-27|18:04:42|0|0|0|1|0|0|0|0|0|0|1|0|0|0|0|0|В Москве прокуратура направила организаторам несанкционированной акции «Стратегия 31» предостережения http://t.co/dtonwQsJ |Москве
<Genproc>|2012-12-28|10:10:36|0|0|0|1|0|0|0|0|0|0|0|0|0|1|0|0|В Челябинской области в суд направлено уголовное дело в отношении главного ветеринарного врача http://t.co/3NupsNU5 |Челябинской области
<Genproc>|2012-12-28|10:43:04|0|0|0|1|0|0|0|0|0|0|0|0|0|1|0|0|В Чеченской Республике возбуждено 8 уголовных дел по фактам суицидов несовершеннолетних http://t.co/5qLLmjWJ |Чеченской республике
<Genproc>|2012-12-28|11:03:09|0|0|0|1|0|0|0|0|0|0|0|0|0|2|0|0|В Подмосковье прокуратура приняла меры к устранению нарушений в организациях, осуществляющих пассажирские перевозки http://t.co/YcQ33Mtb |Подмосковье
