<Genproc>|2013-06-11|15:45:53|0|0|0|3|0|0|0|0|0|0|1|0|0|2|0|0|В Московской области гражданин Латвии осужден за контрабанду кокаина из Доминиканской Республики http://t.co/ym2JLhadUO |Московской области|Латвии|Доминиканской республике
<Genproc>|2013-06-11|16:08:54|0|0|0|1|0|0|0|0|0|0|0|0|0|1|0|0|В Астрахани суд вынес приговор местному жителю, захватившему заложников в рыбопромышленном колледже http://t.co/EnCFG1oWJu |Астрахани
<Genproc>|2013-06-11|16:23:15|0|0|0|2|0|0|0|0|0|0|0|0|1|2|0|0|Вынесен обвинительный приговор по уголовному делу об убийстве замглавы администрации г. Подольска Московской области http://t.co/7q6Cs2poE3 |Подольска|Московской области
<Genproc>|2013-06-11|16:57:07|0|0|0|1|0|0|0|1|0|0|0|0|0|2|0|0|В Ставропольском крае по результатам прокурорской проверки фирма заплатит 1 млн. рублей за незаконное вознаграждение http://t.co/OlcGApSEwe |Ставропольском крае
<Genproc>|2013-06-11|16:58:12|0|0|0|2|0|0|0|0|0|0|0|0|1|1|0|0|В Татарстане осуждены шестеро членов Единой комиссии по размещению госзаказов Центра занятости г. Набережные Челны http://t.co/KVwR1cayuB |Татарстане|Набережные Челны
<Genproc>|2013-06-11|17:28:06|0|0|0|1|0|0|0|0|0|0|0|0|0|2|0|0|В Москве прокуратура предостерегла организаторов публичного мероприятия в центре столицы о недопустимости провокаций http://t.co/Mj7ca9VnZE |Москве
<Genproc>|2013-06-18|10:29:20|0|0|0|0|0|0|0|0|0|0|0|0|0|2|0|0|Прокуратура требует корректировки отдельных нормативных актов органов госвласти и местного самоуправления в СФО http://t.co/RtEvAZIobe 
<Genproc>|2013-06-18|11:00:27|0|0|0|1|0|0|0|0|0|0|0|0|0|2|0|0|В Волгоградской области перед судом предстанет депутат, подозреваемый в даче взятки http://t.co/RdUnfrcYHn |Волгоградской области
<Genproc>|2013-06-18|11:02:00|0|0|0|1|0|0|0|0|0|0|1|0|0|0|0|0|В Псковской области прокуратура защитила жилищные права вдовы участника Великой Отечественной войны http://t.co/V97Tv8gdWb |Псковской области
<Genproc>|2013-06-18|11:04:51|0|0|0|1|0|0|0|0|0|0|0|0|0|3|0|0|ВС России оставил без изменения приговор по уголовному делу о попытке заказного убийства петербургского бизнесмена http://t.co/hm3cc0Y5Hb |России
<Genproc>|2013-06-18|12:36:29|0|0|0|1|0|0|0|1|0|0|0|0|0|1|0|0|В Омской области по результатам прокурорской проверки возбуждено уголовное дело по факту хищения более 14,7 млн. руб, http://t.co/HHLwXyEuSz |Омской области
<Genproc>|2013-06-18|12:37:18|0|0|0|1|0|0|0|0|0|0|0|0|0|0|0|0|В Иркутской области осужден интернет- мошенник http://t.co/spExW9Jiy7 |Иркутской области
<Genproc>|2013-06-18|12:39:38|0|0|0|1|0|0|0|0|0|0|0|0|0|0|0|0|В Московской области прокуратура добилась признания незаконным изменения вида разрешённого использования участков http://t.co/OvfxXgneGi |Московской области
<Genproc>|2013-06-18|13:45:33|0|0|0|1|0|0|0|0|0|0|0|0|0|1|0|0|В Краснодарском крае бывший начальник отдела Туапсинского таможенного поста осужден за получение взятки http://t.co/D1M1VLxnSX |Краснодарском крае
<Genproc>|2013-06-18|13:48:34|0|0|0|1|0|0|0|0|0|0|1|0|0|2|0|0|В Северной Осетии в суд направлено уголовное дело по факту хищения денежных средств, выделенных в поддержку бизнеса http://t.co/IDkid6rICZ |Северной Голландией
<Genproc>|2013-06-18|13:49:49|0|0|0|1|0|0|0|1|0|0|1|0|0|4|0|0|В Татарстане вынесен приговор по уголовному делу о хищении из федерального бюджета свыше 2 млн. рублей http://t.co/rKWK3rlwwg |Татарстане
<Genproc>|2013-06-18|13:50:02|0|0|0|0|0|0|0|0|0|0|0|0|0|2|0|0|В ХМАО водитель осуждён за ДТП, унесшее жизни 22-летней девушки и 26-летнего молодого человека http://t.co/CtF2hZH0xf 
<Genproc>|2013-06-18|13:51:12|0|0|0|1|0|0|0|0|0|0|0|0|0|1|0|0|В Чеченской Республике осуждены участники банды, готовившие подрыв железнодорожного состава с нефтью http://t.co/HGzxoysDgT |Чеченской республике
<Genproc>|2013-06-18|14:06:49|0|0|0|1|0|0|0|0|0|0|0|0|0|2|0|0|В Магадане по результатам прокурорской проверки изъято 11 единиц оборудования, предназначенного для азартных игр http://t.co/I2XbrbwiVj |Магадане
<Genproc>|2013-06-18|14:08:07|0|0|0|0|0|0|0|0|0|0|0|0|0|4|0|0|Прокуратура Нижегородской области установила, что информация в СМИ о смерти ребёнка не соответствует действительности http://t.co/aurokbpF2M 
<Genproc>|2013-06-18|14:09:48|0|0|0|0|0|0|1|0|0|0|0|0|0|3|0|0|На Амуре суд по заявлению прокурора вернул детский оздоровительный лагерь им.«Дзержинского» в собственность города http://t.co/MJ7HGnopJP 
<Genproc>|2013-06-18|16:12:59|0|0|0|1|0|0|0|0|0|0|0|0|0|0|0|0|В Можайске осужден бывший глава сельского поселения Клементьевское http://t.co/J31DkoTk6v |Можайске
<Genproc>|2013-06-18|16:14:15|0|0|0|1|0|0|0|0|0|0|0|0|0|2|0|0|В Орловской области суд обязал ОАО «Ростелеком» блокировать доступ  к ресурсам с признаками финансовых пирамид http://t.co/uwY86xdFgj |Орловской области
<Genproc>|2013-06-18|16:32:28|0|0|0|0|0|0|0|0|0|0|0|0|0|2|0|0|На Урале по результатам прокурорской проверки возбуждено уголовное дело в отношении начальника казенного учреждения http://t.co/FjslzBFk9f 
<Genproc>|2013-06-19|11:31:56|0|0|0|1|0|0|0|0|0|0|0|0|0|2|0|0|В Самарской области прокуратурой организована проверка по факту взрывов на боеприпасном испытательном полигоне http://t.co/FccrNPYQzo |Самарской области
<Genproc>|2013-06-19|11:34:47|0|0|0|1|0|0|0|0|0|0|0|0|0|2|0|0|В Вологодской области по результатам прокурорской проверки возбуждено уголовное дело в отношении начальника СИЗО-3 http://t.co/BedWtDzOPI |Вологодской области
<Genproc>|2013-06-19|11:41:29|0|0|0|1|0|0|0|0|0|0|1|0|0|1|0|0|В Алтайском крае прокуратура защитила право 90-летней местной жительницы на жилье http://t.co/kNhtR5wFpz |Алтайском крае
<Genproc>|2013-06-19|11:43:08|0|0|0|1|0|0|0|0|0|0|0|0|0|2|0|0|В Хакасии по результатам прокурорской проверки возбуждены уголовные дела в отношении директора предприятия http://t.co/ZEmzZ9XYsR |Хакасии
<Genproc>|2013-06-19|11:44:00|0|0|0|0|0|0|0|0|0|0|0|0|0|2|0|0|Гражданин Литовской Республики, обвиняемый в контрабанде 20 кг конопли, экстрадирован на родину http://t.co/HZJafZSUDi 
<Genproc>|2013-06-19|11:45:07|0|0|0|1|0|0|0|0|0|0|0|0|0|0|0|0|На Свердловской железной дороге транспортная прокуратура пресекла незаконное использование знака «BOSCO SPORT RUSSIA» http://t.co/fNYKsmyyzj |Свердловской области
<Genproc>|2013-06-19|12:31:16|0|0|0|1|0|0|0|0|0|0|0|0|0|2|0|0|В Омской области возбуждено уголовное дело по фактам завышения тарифов на тепловую энергию http://t.co/DaOgwSmC4x |Омской области
<Genproc>|2013-06-19|12:32:19|0|0|0|0|0|0|0|0|0|0|0|0|0|0|0|0|Горно-Алтайская межрайонная природоохранная прокуратура требует устранить нарушения ветеринарных правил http://t.co/Ecm11kQ99X 
<Genproc>|2013-06-19|12:40:40|0|0|0|1|0|0|0|0|0|0|0|0|0|3|0|0|В Мордовии за злоупотребление служебным положением и служебный подлог осуждена глава сельского поселения - депутат http://t.co/9GAMoJTSb0 |Мордовии
<Genproc>|2013-06-19|13:10:51|0|0|0|1|0|0|0|0|0|0|1|0|0|1|0|0|В Курганской области прокуратура через суд восстановила бесперебойное водоснабжение более 4 тыс. граждан http://t.co/cyimpbjYmd |Курганской области
<Genproc>|2013-06-19|13:16:38|0|0|0|1|0|0|0|0|0|0|1|0|0|1|0|0|Прокурор Краснодарского края провел личный прием граждан в городе Крымске http://t.co/kcNtTTsNOt |Краснодарского края
<Genproc>|2013-06-19|13:18:59|0|0|0|1|0|0|0|0|0|0|0|0|0|3|0|0|В Карелии по материалам прокурорской проверки возбуждено уголовное дело о хищении УК средств населения за услуги ЖКХ http://t.co/Du7aQ6hNuo |Карелии
<Genproc>|2013-06-19|13:29:31|0|0|0|1|0|0|0|0|0|0|0|0|0|1|0|0|В Калужской области прокуроры направили в суд более 500 исков в целях обеспечения безопасности дорожного движения http://t.co/xjf629H83A |Калужской области
<Genproc>|2013-06-19|13:30:26|0|0|0|2|0|0|0|0|0|0|0|0|0|1|0|0|Осуждены бывшие сотрудники отдела по Орехово-Зуевскому району управления Роснедвижимости по Московской области http://t.co/eAdUnqHIRs |Орехово-Зуевскому району|Московской области
<Genproc>|2013-06-19|13:42:24|0|0|0|1|0|0|0|1|0|0|0|0|0|2|0|0|В ХМАО благодаря вмешательству прокуратуры работникам ЗАО «Нефтемонтажспецстрой» выплачена зарплата на 54 млн. рублей http://t.co/x0EybUAzDq |ЗАО
<Genproc>|2013-06-19|13:43:17|0|0|0|1|0|0|0|0|0|0|1|0|0|3|0|0|В Тюмени к лишению свободы приговорен водитель, который в состоянии опьянения насмерть сбил 11-летнюю школьницу http://t.co/8XwKxE88H5 |Тюмени
<Genproc>|2013-06-19|14:17:21|0|0|0|1|0|0|0|0|0|0|0|0|0|2|0|0|В Санкт-Петербурге прокуратурой выявлены нарушения при заключении договоров долевого участия в строительстве домов http://t.co/m6MnjvCuf6 |Санкт-Петербурге
<Genproc>|2013-06-19|14:19:44|0|0|0|0|0|0|0|0|0|0|1|0|0|2|0|0|В Новгородской области вынесен приговор по  уголовному делу о хранении крупной партии тяжёлых наркотиков http://t.co/hqCAeRj4v0 
<Genproc>|2013-06-19|14:21:13|0|0|0|2|0|0|0|0|0|0|0|0|0|0|0|0|Верховный суд Республики Коми вынес обвинительный приговор бывшему чиновнику регионального управления ФСИН России http://t.co/DwHYj1X90S |Коми|России
<Genproc>|2013-06-19|14:24:31|0|0|0|2|0|0|0|0|0|0|0|0|0|2|0|0|В межрегиональном управлении госавтонадзора по Бурятии и Иркутской области Ространснадзора выявлены нарушения http://t.co/XTpE9dp4cw |Бурятии|Иркутской области
<Genproc>|2013-06-19|14:36:46|0|0|0|1|0|0|0|0|0|0|0|0|0|2|0|0|По материалам прокурорской проверки возбуждено уголовное дело на главу администрации округа в Архангельске http://t.co/LSvkz8vdYY |Архангельске
<Genproc>|2013-06-19|15:20:54|0|0|0|1|0|0|0|1|0|0|0|0|0|2|0|0|В Ульяновске члены преступной группы осуждены за хищение более 90 миллионов рублей, собранных с населения http://t.co/J8b7c9jw3q |Ульяновске
<Genproc>|2013-06-19|15:21:34|0|0|0|1|0|0|0|0|0|0|0|0|0|3|0|0|В Волгоградской области по материалам прокуроров  возбуждено дело об использовании поддельной справки о несудимости http://t.co/BXh8JeVrIn |Волгоградской области
<Genproc>|2013-06-19|15:22:47|0|0|0|1|0|0|0|1|0|0|0|0|0|1|0|0|В Татарстане по результатам прокурорской проверки возбуждено уголовное дело по факту хищения более 5,8 млн. рублей http://t.co/z0ro1wnMUm |Татарстане
<Genproc>|2013-06-19|15:34:06|0|0|0|0|0|0|0|0|0|0|0|0|0|2|0|0|ВС РФ оставил без изменения приговор руководителю преступной группы, торговавшей наркотиками в Новгородской области http://t.co/wUzHZTCSZL 
<Genproc>|2013-06-19|16:12:29|0|0|0|1|0|0|0|1|0|0|0|0|0|1|0|0|В Ставропольском крае по постановлению прокурора юридическое лицо заплатит 1 млн. рублей http://t.co/uXPbqMfYB8 |Ставропольском крае
<Genproc>|2013-06-19|17:15:29|0|0|0|1|0|0|0|0|0|0|0|1|0|2|0|0|В Ульяновске осужден эксфедеральный судья за совершение в состоянии опьянения ДТП, унесшего жизни 2 человек http://t.co/LOReaCuij7 |Ульяновске
<Genproc>|2013-06-19|18:03:31|0|0|0|0|0|0|0|0|0|0|0|0|0|2|0|0|По материалам прокурорской проверки возбуждено уголовное дело о мошенничестве при исполнении госконтракта http://t.co/WrRuxWBGtu 
<Genproc>|2013-06-20|10:18:47|0|0|0|0|0|0|0|0|0|0|1|0|1|4|0|0|Прокурорами ЮФО в текущем году выявлено свыше 500 нарушений законодательства о защите населения от ЧС http://t.co/Bkb0F1zX3d 
<Genproc>|2013-06-20|11:01:27|0|0|0|0|0|0|0|0|0|0|1|0|0|2|0|0|Прокуроры ПФО осуществляют надзор за исполнением законодательства об охране культурного наследия http://t.co/33JX6ohjUY 
<Genproc>|2013-06-20|11:03:13|0|0|0|1|0|0|0|1|0|0|1|0|0|5|0|0|Прокуратура Ставропольского края направила в суд дело об уклонении от уплаты налогов на сумму свыше 75 млн. рублей http://t.co/yr197WIhDS |Ставропольского края
<Genproc>|2013-06-20|11:34:33|0|0|0|1|0|0|0|0|0|0|0|0|0|1|0|0|В Санкт-Петербурге осужден замдиректора коммерческой компании, похитивший деньги фирмы с помощью подложных договоров http://t.co/TzNR1KZNqz |Санкт-Петербурге
<Genproc>|2013-06-20|11:39:32|0|0|0|1|0|0|0|0|0|0|0|0|0|1|0|0|В Республике Алтай суд удовлетворил требования прокуратуры и обязал  получателя жилищной субсидии освободить жилье http://t.co/BmvCqNJnSU |Алтай
<Genproc>|2013-06-20|11:40:24|0|0|0|0|0|0|0|0|0|0|2|0|0|2|0|0|В Сибири прокуроры принимают меры по восстановлению прав граждан в сфере ЖКХ http://t.co/wZVsaV5PQ0 
<Genproc>|2013-06-20|13:31:46|0|0|0|1|0|0|0|0|0|0|0|0|0|1|0|0|В Костромской области направлено в суд уголовное дело в отношении сотрудников полиции http://t.co/OE1iCmMSlR |Костромской области
<Genproc>|2013-06-20|13:50:15|0|0|0|0|0|0|0|0|0|0|0|0|0|3|0|0|Зампрокурора КЧР утвердил обвинительное заключение по уголовному делу о публичном оправдании терроризма в соцсети http://t.co/h3EA3PDjhQ 
<Genproc>|2013-06-20|13:54:23|1|0|0|1|0|0|0|0|0|0|0|0|0|2|0|0|В Ульяновске полицейский осуждён за фальсификацию материалов административных производств и должностные преступления http://t.co/9CAbMoAmSo |Ульяновске
<Genproc>|2013-06-20|14:00:24|0|0|0|1|0|0|0|0|0|0|0|0|0|2|0|0|В Курганской области благодаря мерам прокурорского реагирования вдова ветерана ВОВ получила деньги на новое жилье http://t.co/PJmbldmPdL |Курганской области
<Genproc>|2013-06-20|14:01:54|0|0|0|2|0|0|0|0|0|0|0|0|0|1|0|0|В Хабаровском крае администрация морского порта оштрафована за незаконное использование Государственного герба России http://t.co/g8vJVc88GF |Хабаровском|России
<Genproc>|2013-06-20|14:03:10|0|0|0|1|0|0|0|0|0|0|0|0|0|3|0|0|В Челябинской области будут судить участника нападений на водителей строительной техники, который 7 лет был в розыске http://t.co/7siQrhdQJa |Челябинской области
<Genproc>|2013-06-20|14:57:04|0|0|0|1|0|0|0|0|0|0|0|0|0|2|0|0|В Тюменской области по материалам прокурорской проверки возбуждено уголовное дело о незаконной рубке леса http://t.co/HmoK5a7NLg |Тюменской области
<Genproc>|2013-06-20|15:41:07|0|0|0|1|0|0|0|0|0|0|0|0|0|2|0|0|Прокурор Краснодарского края выехал в воспитательную колонию, где сегодня осуждённым совершены неправомерные действия http://t.co/PKFX2MLLy9 |Краснодарского края
<Genproc>|2013-06-20|15:42:51|0|0|0|0|0|0|0|0|0|0|0|0|0|2|0|0|Генпрокуратура РФ направила в суд уголовное дело в отношении лиц, обвиняемых в бандитизме, грабежах и разбоях http://t.co/nVEtT6Lqim 
<Genproc>|2013-06-20|16:28:34|0|0|0|1|0|0|0|0|0|0|0|0|0|1|0|0|В Брянской области прокуратура направила в суд уголовное дело в отношении организованной преступной группы http://t.co/RPnWOZxpza |Брянской области
<Genproc>|2013-06-20|16:29:21|0|0|0|0|0|0|0|0|0|0|1|0|0|3|0|0|Житель Белгородской области приговорен к пожизненному лишению свободы за убийство женщины и ее малолетней дочери http://t.co/P7jhUtYzlP 
<Genproc>|2013-06-20|16:32:10|0|0|0|1|0|0|0|0|0|0|0|0|0|2|0|0|В Свердловской области по результатам прокурорских проверок уничтожено свыше 600 единиц игрового оборудования http://t.co/gOGTKjfeSn |Свердловской области
<Genproc>|2013-06-20|17:23:06|0|0|0|1|0|0|0|0|0|0|0|0|0|2|0|0|В Мордовии за убийство осуждён участник организованной преступной группы, скрывавшийся от правосудия более 10 лет http://t.co/Zv1SHHsKAW |Мордовии
<Genproc>|2013-06-21|11:01:57|0|0|0|0|0|0|0|0|0|0|0|0|0|1|0|0|Вступил в законную силу обвинительный 9 участникам организованной преступной группы http://t.co/iYAIerCW7p 
<Genproc>|2013-06-21|11:04:43|0|0|0|1|0|0|0|0|0|0|1|0|0|1|0|0|Законодательное Собрание Кировской области приняло закон, внесённый прокурором с целью снижения коррупционных рисков http://t.co/mxO1p1OVGL |Кировской области
<Genproc>|2013-06-21|11:05:56|0|0|1|2|0|0|0|1|0|0|0|0|0|0|0|0|В Татарстане осуждена начальник отдела местного отделения Сбербанка России, похитившая более 7 млн. рублей http://t.co/SXe0zPTioH |Татарстане|России
<Genproc>|2013-06-21|11:17:00|0|0|0|1|0|0|0|0|0|0|1|0|0|2|0|0|По требованию прокурора устав Ленинградской областной торгово-промышленной палаты приведен в соответствие с законом http://t.co/HddNDNQF7I |Ленинградской области
<Genproc>|2013-06-21|11:43:21|0|0|0|0|0|0|0|0|0|0|0|0|0|3|0|0|В Приморье вынесен приговор по уголовному делу о незаконной вырубке леса под строительство лыжного спуска http://t.co/leNacmxK2f 
<Genproc>|2013-06-21|11:44:37|0|0|0|1|0|0|0|0|0|0|0|0|0|4|0|0|В Тюменской области осужден директор строительной фирмы, из-за которого несовершеннолетний упал с крыши дома и погиб http://t.co/R38TWaXH5k |Тюменской области
<Genproc>|2013-06-21|11:49:28|0|0|0|1|0|0|0|0|0|0|1|0|0|1|0|0|В Генпрокуратуре России состоялось заседание межведомственной рабочей группы по защите прав предпринимателей http://t.co/TL3Nm6Hzmc |России
<Genproc>|2013-06-21|13:23:26|0|0|0|1|0|0|0|0|0|0|1|0|0|1|0|0|Верховный Суд РФ поддержал позицию заместителя Генпрокурора РФ Александра Звягинцева о выдаче гражданина Киргизии http://t.co/kLzq1kXjTV |Киргизии
<Genproc>|2013-06-21|13:24:13|0|0|0|0|0|0|0|0|0|0|1|0|0|0|0|0|На Амуре суд обязал ОАО «Ростелеком» устранить нарушения законодательства противодействии экстремизму http://t.co/g7yz5m49mc 
<Genproc>|2013-06-21|13:26:30|0|0|0|1|0|0|0|0|0|0|1|0|0|2|0|0|В Хабаровском крае прокуратура выявила нарушения законодательства при использовании, охране лесов и обороте древесины http://t.co/27bG31QB33 |Хабаровском
<Genproc>|2013-06-21|13:33:14|0|0|0|1|0|0|0|0|0|0|1|0|0|0|0|0|В Астраханской области прокуратура защитила жилищные права вдовы ветерана Великой Отечественной войны http://t.co/HD7eWSKl7U |Астраханской области
<Genproc>|2013-06-21|13:42:54|0|0|0|1|0|0|0|0|0|0|1|0|0|1|0|0|Прокуратура Красноярского края защитила в суде права 74 жильцов разрушающегося общежития в сельском поселке http://t.co/dPQiov1pYw |Красноярского края
