<Genproc>|2013-02-14|14:48:23|0|0|0|1|0|0|0|0|0|0|1|0|0|0|0|0|В Республике Алтай прокуратура защищает трудовые права главного редактора местной газеты http://t.co/8jTDGb4s |Алтай
<Genproc>|2013-02-14|14:50:29|0|0|0|1|0|0|0|0|0|0|0|0|0|1|0|0|В Красноярском крае прокурор добился наказания полицейскому, который выбил глаз задержанному http://t.co/pXeULnw3 |Красноярском
<Genproc>|2013-02-14|14:52:11|0|0|0|0|0|0|0|0|0|0|0|0|1|1|0|0|По итогам работы органов прокуратуры РФ в 2012 г. увеличилось количество выявляемых прокурорами нарушений http://t.co/3kqnKWdZ 
<Genproc>|2013-02-14|14:53:19|0|0|0|0|0|0|0|0|0|0|1|0|0|4|0|0|ГП РФ подвела итоги работы органов прокуратуры по надзору за исполнением законов об отходах производства и потребления http://t.co/YsoGQcx3 
<Genproc>|2013-02-14|15:32:00|0|0|0|1|0|0|0|0|0|0|1|0|0|1|0|0|В Амурской области в результате вмешательства прокуратуры восстановлены жилищные права сирот http://t.co/iWDCKF3O |Амурской области
<Genproc>|2013-02-14|15:35:04|0|0|0|1|0|0|0|0|0|0|1|0|0|2|0|0|В Хабаровском кр. благодаря прокуратуре работникам местной станции скорой медпомощи компенсируют расходы к месту отдыха http://t.co/Zx9f7Zt8 |Хабаровском
<Genproc>|2013-02-14|16:09:22|1|0|0|1|0|0|0|0|0|0|0|0|0|2|0|0|Прокуратура Свердловской области провела проверку в связи с гибелью ребенка в детском доме-интернате http://t.co/ooAr3bLh |Свердловской области
<Genproc>|2013-02-14|16:29:43|0|0|0|0|0|0|0|0|0|0|0|0|0|0|0|0|Замгенпрокурора РФ Юрий Пономарёв объявил главам двух уральских муниципалитетов предостережения http://t.co/WFoDpVhP 
<Genproc>|2013-02-14|16:40:03|0|0|0|1|0|0|0|1|0|0|0|0|0|3|0|0|В Ставропольском крае за получение взятки бывшие участковые приговорены к штрафу в размере более 10 миллионов рублей http://t.co/1NwLutTC |Ставропольском крае
<Genproc>|2013-02-14|16:47:01|0|0|0|1|0|0|0|0|0|0|0|0|0|4|0|0|В Омске осуждены члены преступной группы за незаконное получение в банках в качестве кредитов на сумму свыше 300 млн. http://t.co/wJPI5FWI |Омске
<Genproc>|2013-02-14|16:49:37|0|0|0|1|0|0|0|0|0|0|0|0|0|2|0|0|В Санкт-Петербурге за поджог, повлекший смерть человека, и избиение будут судить группу жителей города http://t.co/EIMhD9rs |Санкт-Петербурге
<Genproc>|2013-02-14|16:51:29|0|0|0|1|0|0|0|0|0|0|0|0|0|1|0|0|В Астраханской области осуждена группа молодых людей, применивших насилие к сотрудникам полиции http://t.co/vMhOik7c |Астраханской области
<Genproc>|2013-02-15|11:45:45|0|0|0|1|0|0|0|0|0|0|0|0|0|3|0|0|В Республике Коми прокуратура принимает меры к застройщику, на объекте которого погибли 6 рабочих http://t.co/JOtKQHaO |Коми
<Genproc>|2013-02-15|11:47:04|0|0|0|1|0|0|0|0|0|0|0|0|0|1|0|0|В Ленинградской области перед судом предстанет бывший глава администрации муниципального образования http://t.co/1xbNjGDV |Ленинградской области
<Genproc>|2013-02-15|11:49:37|0|0|0|1|0|0|0|0|0|0|0|0|0|2|0|0|Во Владимирской области завершена прокурорская проверка в связи с получением травм 9-летним мальчиком http://t.co/wImkSPit |Владимирской области
<Genproc>|2013-02-15|11:52:32|0|0|0|0|0|0|0|1|0|0|0|0|0|1|0|0|По результатам прокурорской проверки возбуждено уголовное дело по факту незаконного расходования 2,8 млн. руб. http://t.co/ouY94QH8 
<Genproc>|2013-02-15|11:54:07|0|0|0|1|0|0|0|0|0|0|1|0|0|1|0|0|В Республике Алтай прокуратура защищает права ребенка-инвалида на пользование воздушным транспортом http://t.co/yuDFKptP |Алтай
<Genproc>|2013-02-15|12:05:44|0|0|0|0|0|0|0|0|0|0|1|0|0|1|0|0|В Нижегородской области прокуратура пресекла трудоустройство в спортивный комплекс судимого гражданина http://t.co/Rtdyrwzs 
<Genproc>|2013-02-15|12:26:25|0|0|0|0|0|0|0|1|0|0|0|0|0|1|0|0|В ЯНАО прокуратура предотвратила незаконную выплату почти 3 млн. рублей бывшему главе муниципального образования http://t.co/RfCJvSQM 
<Genproc>|2013-02-15|12:42:38|0|0|0|2|0|0|0|0|0|0|0|0|0|1|0|0|По результатам прокурорской проверки возбуждено уголовное дело в отношении главы Седельниковского района Омской области http://t.co/cWF3hTFq |Седельниковского района|Омской области
<Genproc>|2013-02-15|12:44:15|0|0|0|1|0|0|0|0|0|0|1|0|0|1|0|0|По постановлениям Мытищинского городского прокурора замруководителя санатория «Аксаково» привлечён к ответственности http://t.co/LQ7GhNd7 |Мытищинского района
<Genproc>|2013-02-15|13:21:35|1|0|0|1|0|0|0|1|0|0|0|0|0|2|0|0|В Бурятии прокуратура выявила нарушения при поставке медоборудования, повлекшие ущерб РФ на сумму 5 млн.860 тыс. руб. http://t.co/0J89PbGs |Бурятии
<Genproc>|2013-02-15|13:49:53|0|0|0|1|0|0|0|0|0|0|0|0|0|2|0|0|Прокуратура Республики Саха (Якутия) приняла меры реагирования по факту отсутствия теплоснабжения в поселке Тикси http://t.co/owtDV8dk |Саха
<Genproc>|2013-02-15|14:19:44|1|0|0|1|0|0|0|0|0|0|0|0|0|2|0|0|В Томской области прокуратура выявила факты жестокого обращения с несовершеннолетними в кадетском корпусе http://t.co/GPFdWdHu |Томской области
<Genproc>|2013-02-15|14:35:47|0|0|0|1|0|0|0|0|0|0|0|0|1|2|0|0|В г. Махачкале прошло совещание по вопросам противодействия экстремизму и терроризму http://t.co/gmaM043O |Махачкале
<Genproc>|2013-02-15|14:49:07|0|0|1|0|0|0|0|0|0|0|1|0|0|1|0|0|По представлению замгенпрокурора РФ Юрия Пономарёва группа должностных лиц Уральского МЧС привлечена к ответственности http://t.co/mivn98Um 
<Genproc>|2013-02-15|15:03:53|0|0|0|1|0|0|0|1|0|0|0|0|0|3|0|0|В Санкт-Петербурге прокуратура не допустила незаконного возмещения НДС почти на 1 млрд. рублей http://t.co/8DRTFK5C |Санкт-Петербурге
<Genproc>|2013-02-15|16:10:53|0|0|0|1|0|0|0|0|0|0|1|0|0|2|0|0|Прокуратура города Кузнецка Пензенской области направила в суд заявления о защите прав несовершеннолетних детей http://t.co/A0fAN1fV |Пензенской области
<Genproc>|2013-02-15|16:14:09|0|0|0|1|0|0|0|0|0|0|1|0|0|1|0|0|В Саратовской обл. по иску прокурора суд обязал министерство здравоохранения обеспечить инвалида лекарствами http://t.co/MvvI6Jvb |Саратовской области
<Genproc>|2013-02-15|16:22:12|1|0|0|1|0|0|0|0|0|0|0|0|0|3|0|0|Заместитель Генпрокурора России Виктор Гринь направил в суд уголовное дело о злостном уклонении от уплаты задолженности http://t.co/rA5SAZgx |России
<Genproc>|2013-02-15|16:46:12|0|0|0|0|0|0|0|0|0|0|0|0|0|3|0|0|В Прикамье направлено в суд уголовное дело по факту покушения на мошенничество в крупном размере http://t.co/u4wgg3bP 
<Genproc>|2013-02-15|16:47:31|0|0|0|1|0|0|0|1|0|0|0|0|0|2|0|0|Прокуратура Оренбургской обл. утвердила обвинительное заключение по делу о хищении 100 млн. рублей http://t.co/rdKoB6b3 |Оренбургской области
<Genproc>|2013-02-15|16:47:37|1|0|0|0|0|0|0|1|0|0|0|0|0|4|0|0|ГВП выявила в ОАО «РЭУ» факты фиктивной оплаты работ при формировании тарифов на тепло на сумму свыше 80 млн. рублей http://t.co/jSicYoLS 
<Genproc>|2013-02-15|16:48:06|0|0|0|1|0|0|0|0|0|0|0|0|0|3|0|0|В Москве вынесен приговор по уголовному делу об организации незаконных азартных игр и покровительстве этой деятельности http://t.co/7BUiLwr9 |Москве
<Genproc>|2013-02-15|17:37:25|0|0|0|0|0|0|0|0|0|0|0|0|0|3|0|0|Направлено в суд уголовное дело об избиении в московском метро журналиста, заступившегося за девушек http://t.co/j0v9SWV0 
<Genproc>|2013-02-18|11:46:30|0|0|0|1|0|0|0|0|0|0|0|0|0|2|0|0|В Новосибирской области вынесен приговор по уголовному делу о сбыте поддельных денежных купюр http://t.co/QaqhX2x2 |Новосибирской области
<Genproc>|2013-02-18|11:47:24|0|0|0|0|0|0|0|0|0|0|0|0|1|3|0|0|В 2012 г. по материалам прокурорских проверок возбуждено 400 уголовных дел в связи с невыплатой зарплаты http://t.co/T0gaMAoc 
<Genproc>|2013-02-18|11:48:25|0|0|0|1|0|0|0|0|0|0|1|0|0|1|0|0|В Алтайском крае перед судом предстанет создательница «финансовой пирамиды», обманувшая 253 граждан http://t.co/q891vFIA |Алтайском крае
<Genproc>|2013-02-18|11:56:40|0|0|0|1|0|0|0|0|0|0|0|0|0|2|0|0|В Тюменской области по постановлению прокурора коммерческая фирма оштрафована за загрязнение окружающей среды http://t.co/JgkrUmy2 |Тюменской области
<Genproc>|2013-02-18|12:43:13|1|0|0|1|0|0|0|0|0|0|0|0|0|1|0|0|В Орловской области удовлетворен иск прокурора о возмещении ущерба http://t.co/H4Anxytr |Орловской области
<Genproc>|2013-02-18|12:43:35|0|0|0|1|0|0|0|1|0|0|0|0|0|2|0|0|По иску прокурора суд обязал администрацию города Волгограда выделить свыше 12 млн. рублей на ремонт школы http://t.co/tppeQksz |Волгограда
<Genproc>|2013-02-18|12:44:47|0|0|0|1|0|0|0|0|0|0|0|0|0|1|0|0|Прокурор Красноярского края в судебном порядке вернул в муниципальную собственность 154 незаконно арендуемых объекта http://t.co/gHdzJh2H |Красноярского края
<Genproc>|2013-02-18|12:49:10|0|0|0|1|0|0|0|0|0|0|0|0|0|3|0|0|В Коми осуждена руководитель предприятия, незаконно взимавшая плату за проезд к причалу парома на реке Печора http://t.co/21tjLegA |Коми
<Genproc>|2013-02-18|14:02:50|0|0|0|1|0|0|0|0|0|0|0|0|0|2|0|0|В Якутии после вмешательства прокуратуры работникам лесопромышленного предприятия выплачена задолженность по зарплате http://t.co/K24LP2kX |Якутии
<Genproc>|2013-02-18|14:04:35|0|0|0|1|0|0|0|0|0|0|0|0|0|2|0|0|В Свердловской области по результатам рассмотрения представления прокуратуры наказано свыше 200 сотрудников полиции http://t.co/mjjNwd8O |Свердловской области
<Genproc>|2013-02-18|14:06:41|0|0|0|1|0|0|0|0|0|0|0|0|0|1|0|0|В Ставропольском крае по возбуждено дело по факту хищения денег жильцов директором управляющей компании http://t.co/bhoXgUSB |Ставропольском крае
<Genproc>|2013-02-18|14:09:12|0|1|0|0|0|0|0|1|0|0|0|0|0|2|0|0|В Нижегородской области прокуратура помогла взыскать в пользу пенсионеров с администрации города более 170 тысяч рублей http://t.co/ac9pecx7 
<Genproc>|2013-02-18|14:11:06|0|0|0|1|0|0|0|1|0|0|1|0|0|3|0|0|В Марий Эл частное образовательное учреждение оштрафовано на 1 миллион рублей за нарушение антикоррупционного закона http://t.co/yXCZ6g20 |Марий Эл
<Genproc>|2013-02-18|14:14:20|0|0|0|1|0|0|0|1|0|0|0|0|0|1|0|0|Прокуратура Чувашии направила в суд дело в отношении бывших руководителей лесхоза, присвоивших 44 млн. рублей http://t.co/Vx89yfuy |Чувашии
<Genproc>|2013-02-18|14:16:21|0|0|0|1|0|0|0|0|0|0|0|0|0|3|0|0|В Карелии благодаря прокуратуре семье из десяти человек выделено новое жильё  взамен уничтоженного пожаром http://t.co/l28qwBAC |Карелии
<Genproc>|2013-02-18|14:29:15|0|0|0|1|0|0|0|0|0|0|0|0|0|2|0|0|В Забайкальском крае по требованию прокуратуры возбуждено уголовное дело в отношении браконьеров, убивших 8 кабанов http://t.co/lQXGui3v |Забайкальском крае
<Genproc>|2013-02-18|14:30:55|0|0|0|1|0|0|0|0|0|0|0|0|0|2|0|0|В Хакасии по материалам прокурорской проверки возбуждено уголовное дело в отношении «черного риэлтора» http://t.co/9xJiXDNA |Хакасии
<Genproc>|2013-02-18|14:55:56|0|0|0|1|0|0|0|0|0|0|1|0|0|2|0|0|В Санкт-Петербурге суд признал законным привлечение ООО «Маржа-СПб» к ответственности за организацию азартных игр http://t.co/0jKQouCv |Санкт-Петербурге
<Genproc>|2013-02-18|15:12:49|0|0|0|1|0|0|0|0|0|0|0|0|0|1|0|0|В Костромской области по иску прокурора суд обязал Департамент здравоохранения области обеспечить инвалида лекарством http://t.co/WQZFXCMm |Костромской области
<Genproc>|2013-02-18|15:13:38|0|0|0|1|0|0|0|0|0|0|0|0|0|1|0|0|По требованию прокурора Омской области отменены незаконные выплаты депутатам Законодательного Собрания и другим лицам http://t.co/MUhZb9mS |Омской области
<Genproc>|2013-02-18|15:16:03|0|0|0|0|0|0|0|1|0|0|0|0|0|2|0|0|В Новгородской области вступил в силу приговор о хищении руководителями кредитного кооператива 149 млн. рублей пайщиков http://t.co/e84d9wgJ 
<Genproc>|2013-02-18|15:24:50|0|0|0|0|0|0|0|1|0|0|1|0|0|3|0|0|В Ленобласти главврач районной больницы по инициативе прокурора оштрафован на 180 тыс. рублей за нарушения законов http://t.co/Idov5OXR 
<Genproc>|2013-02-18|15:44:05|0|0|0|1|0|0|0|0|0|0|0|0|0|1|0|0|В Ставропольском крае по результатам прокурорской проверки возбуждено уголовное дело по факту отравления детей http://t.co/IMXQX2X9 |Ставропольском крае
<Genproc>|2013-02-18|15:51:14|0|0|0|1|0|0|0|0|0|0|0|0|0|2|0|0|ГП РФ организованы  масштабные мероприятия по декриминализации ТЭ и ЖЖ комплексов Мурманской области http://t.co/dzLYDpEa |Мурманской области
<Genproc>|2013-02-18|16:09:15|0|0|0|1|0|0|0|0|0|0|2|0|0|1|0|0|Прокуратура Алтайского края выявила многочисленные нарушения прав граждан при пользовании услугами такси http://t.co/jXTZF9Ju |Алтайского края
<Genproc>|2013-02-18|17:07:47|0|0|0|1|0|0|0|0|0|0|2|0|0|2|0|0|В Пензенской области вынесен приговор бывшему полицейскому, который незаконно привлёк к ответственности 26 граждан http://t.co/Zn9G02S2 |Пензенской области
<Genproc>|2013-02-18|17:16:03|0|0|0|2|0|0|0|0|0|0|0|0|0|2|0|0|В Мордовии состоялся турнир по мини-футболу среди команд органов прокуратуры Российской Федерации http://t.co/2CRKC0I7 |Мордовии|Российской Федерацией
<Genproc>|2013-02-18|17:42:34|0|0|0|1|0|0|0|0|0|0|0|0|0|1|0|0|В Татарстане сотрудник прокуратуры спас девушку от грабителя http://t.co/D185UdwA |Татарстане
<Genproc>|2013-02-19|10:07:51|0|0|0|1|0|0|0|1|0|0|1|0|0|4|0|0|В Республике Алтай вынесен приговор по уголовному делу о хищении из федерального бюджета свыше 75 млн. руб. http://t.co/PwiY8vge |Алтай
<Genproc>|2013-02-19|10:08:54|0|0|0|0|0|0|0|0|0|0|0|0|0|4|0|0|В Тыве осужден водитель, по вине которого погибли четыре пассажира, двое из которых дети http://t.co/DYsECyNN 
<Genproc>|2013-02-19|10:10:34|0|0|0|1|0|0|0|0|0|0|0|0|0|1|0|0|В Хакасии прокуратура в судебном порядке требует прекратить незаконную деятельность букмекерской конторы http://t.co/cMXcssyj |Хакасии
<Genproc>|2013-02-19|11:16:35|0|0|0|1|0|0|0|0|0|0|0|0|0|2|0|0|В Карелии по иску природоохранной прокуратуры снесут туркомплекс, возведенный на самовольно занятом лесном участке http://t.co/U9HxAhqM |Карелии
<Genproc>|2013-02-19|11:17:24|0|0|0|1|0|0|0|0|0|0|0|0|0|1|0|0|По искам прокуратуры в Волгограде будут уничтожены 58 игровых автоматов http://t.co/frCdcv6g |Волгограде
<Genproc>|2013-02-19|12:33:58|0|0|0|1|0|0|0|0|0|0|1|0|0|2|0|0|В Татарстане прокуратура выявила нарушения трудового законодательства в договорах, заключенных с игроками ФК "Рубин" http://t.co/lUHubYsL |Татарстане
<Genproc>|2013-02-19|12:37:53|0|0|0|1|0|0|0|0|0|0|0|0|0|1|0|0|В Ставропольском крае прокуратура провела проверку по факту отравления воспитанников детсада хлорсодержащим средством http://t.co/b1fpuKWL |Ставропольском крае
<Genproc>|2013-02-19|12:58:50|0|0|0|0|0|0|0|0|0|0|1|0|1|1|0|0|В ходе прокурорских проверок в 2012 г. выявлено более 170 тысяч нарушений законов в сфере безопасности ДД http://t.co/dr3ntaWJ 
<Genproc>|2013-02-19|12:59:48|0|0|0|0|0|0|0|0|0|0|0|0|0|1|0|0|В Белгородской области по требованию прокуратуры ликвидирована незаконно организованная парковка http://t.co/SWNFOeUQ 
<Genproc>|2013-02-19|13:01:32|0|0|0|1|0|0|0|0|0|0|0|0|0|0|0|0|В Московской области прокуратура добивается досрочного прекращения полномочий осуждённого председателя Совета депутатов http://t.co/2aDzxAsR |Московской области
<Genproc>|2013-02-19|13:02:18|0|0|0|1|0|0|0|0|0|0|0|0|0|1|0|0|В Калужской области по результатам прокурорской проверки возбуждено уголовное дело http://t.co/IFlFz1Gm |Калужской области
<Genproc>|2013-02-19|14:12:13|0|0|0|1|0|0|0|0|0|0|0|0|0|1|0|0|В Курске по требованию прокуратуры дисквалифицирован генеральный директор управляющей компании http://t.co/3U3ytm5O |Курске
<Genproc>|2013-02-19|14:13:30|0|0|0|1|0|0|0|0|0|0|0|0|0|1|0|0|В Москве по материалам прокурорской проверки возбуждено уголовное дело по факту незаконного нахождения мигрантов http://t.co/OdQaaKSR |Москве
<Genproc>|2013-02-19|14:17:57|0|0|0|1|0|0|0|1|0|0|0|0|0|2|0|0|В Амурской области руководитель организации осужден за хищение у своих знакомых более 27 млн. рублей http://t.co/Jg6gBNU1 |Амурской области
<Genproc>|2013-02-19|14:20:57|0|0|0|1|0|0|0|0|0|0|1|0|0|0|0|0|В Еврейской автономной области прокуратура требует обеспечить надлежащее содержание местных защитных сооружений граждан http://t.co/TqmTux7T |Еврейской автономной области
<Genproc>|2013-02-19|14:39:54|0|0|0|1|0|0|0|0|0|0|1|0|1|1|0|0|В Санкт-Петербурге мужчина, 8 лет истязавший собственную семью, приговорен к 22 годам лишения свободы http://t.co/fBorojXZ |Санкт-Петербурге
<Genproc>|2013-02-19|15:08:51|0|0|0|1|0|0|1|0|0|0|1|0|0|3|0|0|Прокуратура Чеченской республики направила в суд уголовное дело в отношении сотрудника полиции и его сообщника http://t.co/7GYpVEh7 |Чеченской республике
<Genproc>|2013-02-19|15:11:09|0|0|0|1|0|0|0|0|0|0|0|0|0|1|0|0|В Ульяновской области перед судом предстанет депутат представительного органа местного самоуправления http://t.co/csaEHbn8 |Ульяновской области
<Genproc>|2013-02-19|15:15:23|0|0|0|1|0|0|0|0|0|0|0|0|1|2|0|0|В г. Уфе по требованию прокуратуры суд признал экстремистским материал, размещённый в газете http://t.co/B3jiWzFA |Уфе
<Genproc>|2013-02-19|16:08:56|0|0|0|1|0|0|0|0|0|0|0|0|0|1|0|0|В Челябинской области прокуратура помогает ветеранам сохранить объект культурного наследия – мемориал «Клятва» http://t.co/fUG6tfEt |Челябинской области
<Genproc>|2013-02-19|16:45:45|0|0|0|2|0|0|0|0|0|0|0|0|0|3|0|0|В Мордовии органы прокуратуры приняли меры по устранению нарушений на полигоне бытовых отходов в Лямбирском районе http://t.co/phhQS71f |Мордовии|Лямбирском районе
<Genproc>|2013-02-19|16:48:29|0|0|0|1|0|0|0|0|0|0|0|0|0|2|0|0|В Ставропольском крае направлено в суд дело в отношении адвоката, который завладел денежными средствами подзащитного http://t.co/WfBo77Y7 |Ставропольском крае
