<Genproc>|2013-04-10|14:02:42|0|0|0|1|0|0|0|0|0|0|0|0|0|1|0|0|В Костромской области возбуждены уголовные дела в отношении чиновников администрации |Костромской области
<Genproc>|2013-04-10|14:06:32|0|0|0|0|0|0|0|0|0|0|0|0|0|2|0|0|В Воронеже направлено в суд уголовное дело о нарушении тайны телефонных переговоров http://t.co/udag6Dno7g 
<Genproc>|2013-04-10|14:41:08|0|0|0|0|0|0|0|0|0|0|1|0|0|1|0|0|Прокуратура выявила нарушения законодательства в Санкт-Петербургском государственном лесотехническом университете http://t.co/qjL7C7vGNl 
<Genproc>|2013-04-10|15:27:06|0|0|0|0|0|0|0|1|0|0|0|0|0|1|0|0|В ПФО принятыми мерами прокурорского реагирования задолженность коммунальных организаций снижена на 1,5 млрд. рублей http://t.co/QXBUFOYi1S 
<Genproc>|2013-04-10|15:39:16|0|0|0|1|0|0|0|0|0|0|0|0|0|2|0|0|В Курской области прокурор направил в суд уголовное дело о незаконном сбыте государственных наград времен ВОВ http://t.co/brFtMUbOrC |Курской области
<Genproc>|2013-04-10|15:40:23|0|0|0|1|0|0|0|0|0|0|0|0|0|0|0|0|В Москве осуждены очередные участники преступного сообщества «черных риэлторов» http://t.co/4JpedAe8tC |Москве
<Genproc>|2013-04-10|15:58:22|0|0|0|1|0|0|0|0|0|0|0|0|0|1|0|0|Заместитель Генпрокурора Российской Федерации Юрий Пономарёв в Екатеринбурге провел межведомственное совещание http://t.co/PRJu5BC9pP |Российской Федерацией
<Genproc>|2013-04-10|16:14:55|0|0|0|0|0|0|0|0|0|0|0|0|0|3|0|0|Замгенпрокурора РФ С. Зайцев утвердил обвинительное заключение по уголовному делу о подготовке к сбыту наркотиков http://t.co/wajTX002Bs 
<Genproc>|2013-04-10|16:17:33|0|0|0|0|0|0|0|1|0|0|0|0|0|3|0|0|Заместитель прокурора КЧР утвердил обвинительное заключение по уголовному делу о покушении на хищение 26 млн. рублей http://t.co/GtDY2y0Pu9 
<Genproc>|2013-04-10|16:18:57|0|0|0|0|0|0|0|0|0|0|0|0|0|3|0|0|Прокуратура Нижегородской области организовала проверку по факту провала грунта около жилых домов в посёлке Бутурлино http://t.co/UWCcX5vk60 
<Genproc>|2013-04-10|17:39:08|0|0|0|1|0|0|0|0|0|0|0|0|0|1|0|0|По инициативе Генеральной прокуратуры России возбуждено уголовное дело в отношении  Ахмеда Билалова http://t.co/YdFz8SuQ7m |России
<Genproc>|2013-04-10|18:14:31|0|0|0|0|0|0|0|0|0|0|0|0|0|1|0|0|Приказом Генерального прокурора РФ за нарушение Присяги прокурора уволены два сотрудника органов прокуратуры http://t.co/U3U2iqwwdD 
<Genproc>|2013-04-11|09:18:12|0|0|0|2|0|0|0|0|0|0|0|0|1|1|0|0|В г. Улан-Удэ под председательством Генерального прокурора России Юрия Чайки состоялось совещание |Улан-Удэ|России
<Genproc>|2013-04-11|10:44:06|0|0|0|1|0|0|0|0|0|0|1|0|0|1|0|0|В Ульяновске перед судом предстанет депутат городской думы, растративший средства муниципального предприятия http://t.co/vTZE6V6bmg |Ульяновске
<Genproc>|2013-04-11|11:16:27|0|0|0|1|0|0|0|0|0|0|0|0|0|2|0|0|В Астрахани суд удовлетворил требования прокуратуры о запрете  незаконной азартной деятельности под видом лотереи http://t.co/MVOVkiXhXx |Астрахани
<Genproc>|2013-04-11|11:19:49|0|0|0|1|0|0|0|0|0|0|1|0|0|2|0|0|В Санкт-Петербурге после прокурорской проверки привлечены к ответственности 27 должностных лиц детских садов http://t.co/QSmiAZwhO1 |Санкт-Петербурге
<Genproc>|2013-04-11|11:27:29|0|0|0|1|0|0|0|0|0|0|0|0|0|1|0|0|В Забайкальском крае газосварщик обвиняется в уничтожении здания детского сада http://t.co/XXYlv44FbZ |Забайкальском крае
<Genproc>|2013-04-11|11:28:56|0|0|0|1|0|0|0|0|0|0|0|0|0|2|0|0|В Омской области по требованию прокуратуры суд обязал отстранить судимого депутата от исполнения своих полномочий http://t.co/7uj2mpvkel |Омской области
<Genproc>|2013-04-11|11:30:42|0|0|0|0|0|0|0|0|0|0|0|0|0|0|0|0|По постановлению Горно-Алтайского природоохранного прокурора исправительное учреждение заплатит штраф http://t.co/wbg7NuZ6iw 
<Genproc>|2013-04-11|11:32:00|0|0|0|2|0|0|0|0|0|0|1|0|0|4|0|0|В Забайкальском крае вынесен приговор по уголовному делу о контрабанде крупной партии золота и серебра в Китай http://t.co/1Bz4d26zYZ |Забайкальском крае|Китай
<Genproc>|2013-04-11|12:23:31|0|0|0|0|0|0|0|0|0|0|0|0|0|1|0|0|Направлено в суд уголовное дело в отношении командира авиационной группы «Стрижи» http://t.co/GghaUd4PxT 
<Genproc>|2013-04-11|12:26:12|0|0|0|1|0|0|0|0|0|0|0|0|0|2|0|0|В Кемеровской области вынесен приговор по уголовному делу о создании общественной организации «Преображение России» |Кемеровской области
<Genproc>|2013-04-11|12:27:22|0|0|0|1|0|0|0|0|0|0|0|0|0|2|0|0|Заместитель Генпрокурора России Сергей Воробьёв направил в суд уголовные дела об организации занятия проституцией http://t.co/WWNHV4WTmF |России
<Genproc>|2013-04-11|12:27:35|0|0|0|1|0|0|0|0|0|0|0|0|0|1|0|0|В Московской области направлено в суд уголовное дело в отношении организатора экстремистского объединения http://t.co/E3FuKDyIhs |Московской области
<Genproc>|2013-04-11|13:58:01|0|0|0|1|0|0|0|0|0|0|1|0|0|0|0|0|По результатам проверок деятельности предприятий ТЭК прокуратура Тюменской области выявила 160 нарушений закона http://t.co/m45fo5FIkZ |Тюменской области
<Genproc>|2013-04-11|14:00:02|0|0|0|0|0|0|0|1|0|0|1|0|0|1|0|0|На Чукотке прокуратура защитила права 5 детей, которым коммунальщики выставили счет на 200 тыс. рублей http://t.co/Y211ZAN06Q 
<Genproc>|2013-04-11|14:33:49|0|0|0|1|0|0|0|0|0|0|0|0|0|0|0|0|Назначен прокурор Ульяновской области http://t.co/vkGaICMFOP |Ульяновской области
<Genproc>|2013-04-11|14:46:38|0|0|0|1|0|0|0|0|0|0|0|0|0|2|0|0|Военные прокуроры завершили проверку использования земель обороны на полигоне в Ленинградской области http://t.co/VrYSWGG6tH |Ленинградской области
<Genproc>|2013-04-11|15:59:20|0|0|0|0|0|0|1|0|0|0|0|0|0|3|0|0|Возбуждено уголовное дело в отношении ряда государственных инспекторов ГИБДД и их пособников http://t.co/yap1BAIXPu 
<Genproc>|2013-04-11|16:06:01|0|0|0|0|0|0|0|0|0|0|1|0|0|4|0|0|Интервью начальника отдела по надзору за исполнением законов о безопасности дорожного движения А.Русецкого в "МК" http://t.co/kr5BJAwFDc 
<Genproc>|2013-04-11|16:10:21|0|0|0|1|0|0|0|0|0|0|0|0|1|1|0|0|В г. Твери по требованию природоохранной прокуратуры досрочно отремонтирован канализационный коллектор http://t.co/CMyBFIJtNh |Твери
<Genproc>|2013-04-11|16:12:29|0|0|0|2|0|0|0|0|0|0|0|0|0|2|0|0|Направлено в суд  дело в отношении должностных лиц Плавского бюро медико-социальной экспертизы по Тульской области http://t.co/QWboIzI7rP |Плавского района|Тульской области
<Genproc>|2013-04-11|16:16:17|0|0|0|1|0|0|0|0|0|0|1|0|0|2|0|0|Прокуратура Мурманской области выявила нарушения законов о доступности и бесплатности детсадов http://t.co/hvwZ8uIVBz |Мурманской области
<Genproc>|2013-04-11|16:18:21|0|0|0|1|0|0|0|0|0|0|0|0|0|1|0|0|В результате вмешательства Южной транспортной прокуратуры погашены долги по зарплате работникам "Авиалиний Кубани" http://t.co/BYamz0n1lh |Южной Голландией
<Genproc>|2013-04-11|16:19:46|0|0|0|1|0|0|0|0|0|0|2|0|0|1|0|0|Прокуратура Ненецкого автономного округа проверила исполнение законов о правах несовершеннолетних http://t.co/7nX5sJZ4kP |Ненецкого автономного округа
<Genproc>|2013-04-11|16:21:17|0|0|0|1|0|0|0|0|0|0|0|0|0|2|0|0|Ленинградский облсуд по представлению прокурора отменил постановление о прекращении дела о подкупе избирателей http://t.co/iWeSGbKSpw |Ленинградский район
<Genproc>|2013-04-11|16:22:45|0|0|0|1|0|0|0|0|0|0|0|0|0|2|0|0|По иску прокурора суд обязал администрацию района в Вологодской области построить новую автодорогу взамен утраченной http://t.co/vc1aXL8f2O |Вологодской области
<Genproc>|2013-04-11|16:24:29|0|0|0|1|0|0|0|0|0|0|0|0|0|2|0|0|По инициативе прокуратуры оштрафован чиновник комитета Волгоградской области по подготовке к ЧМ по футболу-2018 http://t.co/sZk7kVa9ZQ |Волгоградской области
<Genproc>|2013-04-11|16:33:20|1|0|0|0|0|0|0|0|0|0|0|0|0|2|0|0|В Белгородской области осужден предприниматель за причинение многомиллионного ущерба правообладателям видео и аудио http://t.co/8XLWuwvTMi 
<Genproc>|2013-04-11|16:49:03|0|0|0|1|0|0|0|0|0|0|0|0|0|0|0|0|Во Владимирской области прокуратура добилась предоставления многодетной матери квартиры http://t.co/8Ysz5Arpvq |Владимирской области
<Genproc>|2013-04-11|17:09:22|0|0|0|0|0|0|0|0|0|0|0|0|0|1|0|0|Замгенпрокурора РФ И.Сыдорук направил в суд уголовное дело в отношении участника банды, обвиняемого в убийствах http://t.co/YfHeCiF94H 
<Genproc>|2013-04-11|17:58:36|0|0|0|0|0|0|0|0|0|0|1|0|0|1|0|0|Управление Генпрокуратуры РФ в ПФО выявило многочисленные нарушения прав предпринимателей в ряде органов контроля http://t.co/zXvB8oKtsH 
<Genproc>|2013-04-12|10:10:48|0|0|0|0|0|0|0|0|0|0|0|0|1|2|0|0|Прокуратура проводит проверку по факту смерти новорожденного в КГБУЗ «Родильный дом № 1 г. Барнаула» 
<Genproc>|2013-04-12|12:38:10|0|0|0|1|0|0|0|1|0|0|0|0|0|2|0|0|В Петербурге возбуждено дело о попытке незаконного возмещения руководством ООО «Лотос» НДС в размере 35 млн. рублей http://t.co/Wb8qhDDiDL |Петербурге
<Genproc>|2013-04-12|12:40:15|0|0|0|1|0|0|0|1|0|0|1|0|0|3|0|0|Прокуратура Волгоградской области направила в суд дело о незаконной игорной деятельности с доходом в 65 млн. рублей http://t.co/D5aenX2rPM |Волгоградской области
<Genproc>|2013-04-12|13:03:38|0|0|0|0|0|0|0|0|0|0|0|0|0|2|0|0|В ХМАО прокуратура добилась дисквалификации директора коммерческой организации, который не платил работникам зарплату http://t.co/Pq0iePfecs 
<Genproc>|2013-04-12|15:00:31|0|0|0|0|0|0|0|1|0|0|0|0|0|2|0|0|В ЯНАО за дачу мелких взяток сотрудниками две фирмы заплатили штрафы по 1 млн. рублей http://t.co/wf9xmQNAEJ 
<Genproc>|2013-04-12|15:00:33|0|0|0|1|0|0|0|0|0|0|0|0|0|1|0|0|Ленинградский облсуд по апелляционному представлению природоохранного прокурора запретил деятельность свалки отходов http://t.co/DJ0TL8X7pd |Ленинградский район
<Genproc>|2013-04-12|15:01:25|0|0|0|1|0|0|0|0|0|0|1|0|0|2|0|0|О визите группы экспертов Евросоюза в Генеральную прокуратуру России по вопросу безвизового режима взаимных поездок http://t.co/ilVyBbLpad |России
<Genproc>|2013-04-12|15:02:26|0|0|0|1|0|0|0|0|0|0|0|0|0|2|0|0|В Магаданской области прокуратура пресекает незаконную деятельность по проведению азартных игр под видом лотерей http://t.co/5iKl68pGD7 |Магаданской области
<Genproc>|2013-04-12|15:43:58|0|0|0|2|0|0|0|0|0|0|1|0|0|2|0|0|Об экстрадиции из Республики Кипр в Россию гражданина РФ Дмитрия Зубахи, обвиняемого в краже http://t.co/mMijAAcE80 |Кипр|Россию
<Genproc>|2013-04-12|15:51:40|0|0|0|1|0|0|0|0|0|0|1|0|0|1|0|0|В Псковской области прокуратура принимает меры по восстановлению нарушенных жилищных прав детей http://t.co/dWzEVCPHjk |Псковской области
<Genproc>|2013-04-12|16:08:18|0|0|0|0|0|0|0|0|0|0|2|0|0|2|0|0|Транспортные прокуроры принимают меры к обеспечению прав граждан на получение жилищно-коммунальных услуг http://t.co/UJfD7OkuXS 
<Genproc>|2013-04-12|16:27:54|0|0|0|1|0|0|0|0|0|0|0|0|0|2|0|0|В Воронежской области по материалам прокурорской проверки  возбуждено уголовное дело о невыплате зарплаты http://t.co/w7mqs8M8aQ |Воронежской области
<Genproc>|2013-04-12|16:55:14|0|0|0|1|0|0|0|1|0|0|0|0|0|1|0|0|В Ставропольском крае направлено в суд уголовное дело в отношении руководителей фирмы, похитивших 200 млн. рублей http://t.co/AIqUKuqOs9 |Ставропольском крае
<Genproc>|2013-04-12|16:59:14|0|0|0|1|0|0|0|0|0|0|0|0|0|0|0|0|В Оренбургской области осуждены четверо последователей запрещённой экстремистской организации "Таблиги Джамаат" http://t.co/rmJfRs1JyN |Оренбургской области
<Genproc>|2013-04-12|17:00:54|0|0|0|1|0|0|0|0|0|0|0|0|0|1|0|0|В Ульяновске генеральный директор крупной управляющей компании осуждён за коммерческий подкуп http://t.co/Gv6WN6K68j |Ульяновске
<Genproc>|2013-04-15|10:55:35|0|0|0|1|0|0|0|0|0|0|0|0|0|2|0|0|В Дагестане по инициативе прокурора уволен с должности первый заместитель главы муниципального образования http://t.co/c0QBQOOVB0 |Дагестане
<Genproc>|2013-04-15|12:09:31|0|0|0|1|0|0|0|0|0|0|1|0|0|0|0|0|В Иркутской области прокуратура защитила права ветерана Великой Отечественной войны http://t.co/PQaUZWp9zu |Иркутской области
<Genproc>|2013-04-15|12:12:09|0|0|1|2|0|0|0|1|0|0|0|0|0|2|0|0|В Тюменской области за хищение у вкладчиков более 2 млн. рублей осуждена бывшая сотрудница Сбербанка России http://t.co/HPHUUfLQdA |Тюменской области|России
<Genproc>|2013-04-15|12:12:09|0|0|0|1|0|0|0|0|0|0|1|0|0|2|0|0|В Костромской области прокуратура требует привести Программу госгарантий в соответствие с законом http://t.co/mmF6Sarn48 |Костромской области
<Genproc>|2013-04-15|12:19:42|0|0|0|0|0|0|0|0|0|0|1|0|0|1|0|0|На Камчатке региональный экс-министр спорта оштрафован за ограничение конкуренции http://t.co/PTo6OIPx2U 
<Genproc>|2013-04-15|12:29:02|0|0|0|1|0|0|0|0|0|0|1|0|0|1|0|0|В Татарстане благодаря вмешательству прокуратуры восстановлены жилищные права двух сирот http://t.co/LQyXxlGeON |Татарстане
<Genproc>|2013-04-15|12:30:28|0|0|0|0|0|0|0|1|0|0|0|0|0|1|0|0|Ульяновский предприниматель осуждён за хищение более 2 миллионов рублей бюджетных средств http://t.co/EFKyej7Wp1 
<Genproc>|2013-04-15|12:57:51|0|0|0|1|0|0|0|0|0|0|0|0|0|2|0|0|Генеральная прокуратура России направила в суд уголовное дело о незаконном обороте наркотиков http://t.co/bXkxBYFsq1 |России
<Genproc>|2013-04-15|13:29:17|0|0|0|0|0|0|0|0|0|0|1|0|1|2|0|0|Житель Новгородской области осуждён к 23 годам лишения свободы за сбыт наркотиков http://t.co/ug8otlKMDI 
<Genproc>|2013-04-15|15:12:23|0|0|0|1|0|0|0|1|0|0|0|0|0|3|0|0|В Башкортостане  по требованию прокуратуры коммерческая фирма оштрафована на 500 тыс. рублей за незаконную стройку http://t.co/5j7cCvwJeO |Башкортостане
<Genproc>|2013-04-15|15:14:16|0|0|0|0|0|0|0|0|0|0|0|0|0|1|0|0|В Нижегородской области прокуратура добилась возбуждения уголовных дел в отношении директора предприятий http://t.co/X1Fk9KAUr4 
<Genproc>|2013-04-15|15:15:29|0|0|0|1|0|0|0|0|0|0|1|0|0|1|0|0|На Дальнем Востоке управление Генпрокуратуры РФ проверило подготовку местных органов власти к пожароопасному периоду http://t.co/JW6duHigfD |Дальнем Востоке
<Genproc>|2013-04-15|15:16:51|0|0|0|0|0|0|0|0|0|0|1|0|0|3|0|0|Управление Генпрокуратуры РФ в СЗФО выявило нарушения законодательства о госслужбе и в сфере госзаказов в ИФНС http://t.co/Y2MsauhZ3I 
<Genproc>|2013-04-15|15:58:50|1|0|0|0|0|0|0|0|0|0|0|0|0|4|0|0|На Амуре прокуратура через суд обязала ИП возместить вред женщине и ее сыну, на которых упала крыша http://t.co/dzUuCPWFkl 
<Genproc>|2013-04-15|17:39:19|0|0|0|1|0|0|0|0|0|0|0|0|0|1|0|0|Направлено в суд уголовное дело в отношении начальника отдела таможенного поста Астраханской таможни http://t.co/n8ygd1HKx7 |Астраханской области
<Genproc>|2013-04-16|10:23:02|0|0|0|1|0|0|0|1|0|0|0|0|0|2|0|0|В Башкортостане коммерческая  фирма оштрафована на 20 млн. рублей за попытку подкупа http://t.co/b4h9WNpYuc |Башкортостане
<Genproc>|2013-04-16|10:26:13|0|0|0|1|0|0|0|0|0|0|0|0|0|3|0|0|В Татарстане начальник отдела регионального МВД предстанет перед судом по обвинению в даче взятки http://t.co/Ix06W58FVp |Татарстане
<Genproc>|2013-04-16|10:28:37|0|0|0|1|0|0|0|0|0|0|0|0|0|1|0|0|В Самарской области направлено в суд уголовное дело в отношении бывшего директора ОАО «Авиаагрегат» http://t.co/xIjnwu1m1b |Самарской области
<Genproc>|2013-04-16|11:21:03|0|0|0|1|0|0|0|1|0|0|0|0|0|1|0|0|В Ивановской области местный житель заплатит 3 миллиона рублей штрафа за попытку дать взятку сотруднику ФСБ http://t.co/Rz6AiFVlpp |Ивановской области
<Genproc>|2013-04-16|11:40:20|0|0|0|0|0|0|0|0|0|0|1|0|0|1|0|0|На Амуре по материалам прокурорской проверки возбуждено уголовное дело по факту хищения денежных средств граждан http://t.co/l4rLsj4JgO 
<Genproc>|2013-04-16|12:04:25|0|0|0|0|0|0|0|0|0|0|0|0|0|2|0|0|На Камчатке перед судом предстанет конкурсный управляющий, обвиняемый в ряде коммерческих преступлений http://t.co/yTc5x0xFMH 
<Genproc>|2013-04-16|12:05:27|1|0|0|1|0|0|0|0|0|0|0|0|0|2|0|0|В Ставропольском крае направлено в суд уголовное дело по факту гибели в дорожно-транспортном происшествии детей http://t.co/Ra37nt59uQ |Ставропольском крае
<Genproc>|2013-04-16|12:10:05|0|0|0|1|0|0|0|0|0|0|0|0|0|0|0|0|В Оренбургской области осуждён главный врач, создававший видимость работы противотуберкулезного диспансера http://t.co/a095wMyt1z |Оренбургской области
<Genproc>|2013-04-16|12:58:25|0|0|0|0|0|0|0|0|0|0|0|0|0|0|0|0|Заместитель Генерального прокурора РФ Александр Гуцан внес представление руководителю окружного Росрыболовства http://t.co/tPQ4YQFCF9 
<Genproc>|2013-04-16|13:00:42|0|0|0|0|0|0|0|0|0|0|0|0|0|0|0|0|По результатам проверки военной прокуратуры Ракетных войск возбуждено уголовное дело http://t.co/JCjv8tciVK 
<Genproc>|2013-04-16|13:03:31|0|0|0|1|0|0|0|0|0|0|0|0|0|1|0|0|В Курской области депутат Представительного Собрания осужден за мошенничество http://t.co/UrIv9xiyoj |Курской области
<Genproc>|2013-04-16|14:47:06|0|0|0|0|0|0|0|0|0|0|2|0|0|3|0|0|ГП РФ обобщила состояние законности и практику прокурорского надзора в сфере соблюдения закона о воинской обязанности http://t.co/OEgD3EjA5c 
<Genproc>|2013-04-16|15:29:13|0|0|0|0|0|0|0|1|0|0|1|0|0|3|0|0|Прокуратура выявила факт необоснованного перечисления из бюджета около 5 млн. рублей по государственному контракту http://t.co/meCUgzFjgz 
<Genproc>|2013-04-16|15:39:43|0|0|0|1|0|0|0|0|0|0|0|1|0|0|0|0|По инициативе прокуратуры Волгоградской обл. министру образования региона назначено административное наказание http://t.co/NLQ8gmkpOh |Волгоградской области
