<MintrudRF>|2013-05-20|17:42:59|0|0|0|4|0|0|0|0|0|0|0|0|1|3|0|0|В этом году открыто семь новых учреждений летнего отдыха детей: в Краснодарском крае, Чувашии, Брянской области и Республике Саха (Якутия) |Краснодарском крае|Чувашии|Брянской области|Саха
<MintrudRF>|2013-05-20|17:45:14|0|0|0|0|0|0|0|0|0|0|0|0|0|2|0|0|М. Топилин: Страхование детей является обязательным условием государственного контракта на оказание услуг по организации летнего отдыха 
<MintrudRF>|2013-05-20|18:28:28|0|0|0|0|0|0|0|0|0|0|0|0|0|2|0|0|Стенограмма выступления Министра М. Топилина на совещании-видеоконференции об организации детского отдыха http://t.co/AjGoWX6rJ1 
<MintrudRF>|2013-05-20|18:32:05|0|0|1|0|0|0|0|0|0|0|0|0|0|1|0|0|ИТАР-ТАСС : Пенсионный калькулятор готовится к работе http://t.co/F1hgzjGL57 
<MintrudRF>|2013-05-20|18:33:01|0|1|0|0|0|0|0|0|0|0|0|0|0|3|0|0|Минтруд надеется в течение полутора недель снять разногласия по пенсионной формуле. - PосБизнесКонсалтинг http://t.co/NcQVTJDzg5 
<MintrudRF>|2013-05-21|11:57:55|0|0|0|0|0|0|0|0|0|0|0|0|0|1|0|0|Министр Максим Топилин: Службы занятости должны идти к инвалиду http://t.co/1W9ZZyVp6a #инвалиды 
<MintrudRF>|2013-05-21|11:59:00|0|0|0|0|0|0|0|0|0|0|0|0|0|1|1|0|RT @Pravitelstvo_RF: Заработал новый официальный сайт Правительства - http://t.co/TDuMCJQ0m6 
<MintrudRF>|2013-05-21|14:02:32|0|0|0|0|0|0|0|0|0|0|0|0|0|2|0|0|Светлана Нечаева: Число вакансий в службах занятости вдвое превышает число безработных http://t.co/FHwhPXcHHP 
<MintrudRF>|2013-05-21|14:04:28|0|0|0|1|0|0|0|0|0|0|0|0|1|3|0|0|Светлана Нечаева: До конца 2015 года в России должна быть создана 71 тысяча рабочих мест для инвалидов http://t.co/FHwhPXcHHP |России
<MintrudRF>|2013-05-22|13:33:01|0|0|0|1|0|0|0|0|0|0|1|0|0|3|0|0|Государственная Дума РФ ратифицировала Конвенцию МОТ о безопасности и гигиене труда на шахтах http://t.co/wwEe8Iq2nQ |Дума
<MintrudRF>|2013-05-22|13:35:14|0|0|0|0|0|0|0|0|0|0|0|0|0|3|0|0|Г. Лекарев опроверг информацию о том, что финансирование госпрограммы "Доступная среда", сокращено http://t.co/Nk6gQe3PX5 
<MintrudRF>|2013-05-22|13:39:42|0|0|0|0|0|0|0|0|0|0|0|0|1|3|0|0|Пятую часть школ РФ к 2016 году приспособят для детей с инвалидностью http://t.co/I1DXxZFx6u #инвалиды 
<MintrudRF>|2013-05-22|17:21:07|0|0|0|0|0|0|0|0|0|0|0|0|1|7|0|0|А. Пудов - о законопроекте, по которому в стаж для исчисления пенсий будет засчитываться не 3 "декретных" года, а 4,5 http://t.co/tyJSt9Fblb 
<MintrudRF>|2013-05-23|13:27:49|0|0|0|0|0|0|0|0|0|0|0|0|1|3|0|0|Cостоялось первое в 2013 году заседание Координационного совета по контролю за реализацией программы «Доступная среда»http://t.co/lZ6ycjQtjC 
<MintrudRF>|2013-05-23|16:46:58|0|0|0|1|0|0|0|0|0|0|0|0|1|5|0|0|Министр Топилин представил на заседании Правительства РФ отчеты об исполнении бюджетов ПФР и ФСС России за 2012 год http://t.co/svuS0HDOBW |России
<MintrudRF>|2013-05-27|15:09:36|0|0|0|0|0|0|0|0|0|0|0|0|0|0|1|0|RT @pension_fond: Материнский капитал улучшил жилищные условия более 1,7 млн российских семей http://t.co/EWYSctHIgX 
<MintrudRF>|2013-05-27|15:15:44|0|0|0|1|0|0|0|0|0|0|0|0|0|1|0|0|Министр Максим Топилин провел очередное заседание Коллегии Минтруда России. На повестке - спецоценка условий труда http://t.co/RYsaI44tbS |России
<MintrudRF>|2013-05-27|18:05:28|0|0|0|0|0|0|0|0|0|0|0|0|1|5|0|0|Замминистра А. Пудов на "ТВЦ" - об инициативе Минтруда, в соотв. с кот. в стаж будут засчитывать 4,5 декретных года http://t.co/rjy3Umjv4R 
<MintrudRF>|2013-05-27|18:08:23|0|0|0|0|0|0|0|0|0|0|0|0|0|0|0|0|Директор деп-та В. Корж: техрегламент Таможенного союза «О безопасности СИЗ» призван повысить безопасность работников http://t.co/CjcYINgLMl 
<MintrudRF>|2013-05-27|18:48:50|0|0|0|0|0|0|0|0|0|0|0|0|1|3|0|0|Замминистра А. Вовченко в программе "Сегодня" канала "НТВ" - об организации детского летнего отдыха в 2013 году http://t.co/JTB9AFXhb6 
<MintrudRF>|2013-05-28|20:48:41|0|0|0|0|0|0|0|0|0|0|1|0|0|5|0|0|Информация @opora_russia о том, что Минтруд стал инициатором сокращения в Бюджете-2013 субсидий бизнесу не верна http://t.co/M5AwjPq6jt 
<MintrudRF>|2013-05-28|20:56:16|0|0|0|0|0|0|0|0|0|0|0|0|0|2|0|0|Министр Максим Топилин - о независимой оценке работы учреждений соцсферы http://t.co/R7ETF79TCn 
<MintrudRF>|2013-05-29|10:42:04|0|0|0|0|0|0|0|0|0|0|0|0|0|3|0|0|Миинистр М. Топилин - в эфире "Россия 24" прямо сейчас! http://t.co/L8IbQKhVkt 
<MintrudRF>|2013-05-29|12:48:58|0|0|0|0|0|0|0|0|0|0|0|0|0|5|0|0|Министр М. Топилин - "Финмаркету" о том, что нельзя допустить сокращения пенсионных и других страховых выплат http://t.co/DYgKgmIEXa #пенсии 
<MintrudRF>|2013-05-29|17:44:28|0|0|0|0|0|0|0|0|0|0|0|0|0|2|0|0|Министр М. Топилин призвал резерв управленч. кадров при обучении решать стоящие перед ведомствами задачи http://t.co/9x3wk3D0d4 #госслужба 
<MintrudRF>|2013-05-29|19:19:58|0|0|0|0|0|0|0|0|0|0|0|1|0|1|0|0|Видео и стенограмма интервью министра Максима Топилина каналу "Россия 24" http://t.co/2lnvMPB74f #пенсии #рыноктруда #дети #семья #инвалиды 
<MintrudRF>|2013-05-30|13:10:29|0|0|0|0|0|0|0|0|0|0|0|0|0|5|0|0|Замминистра Алексей Вовченко на "ТВЦ" - о ежемесячном пособии на третьего ребенка и летнем отдыхе для детей http://t.co/RqmhCciBjU 
<MintrudRF>|2013-05-30|18:33:26|0|0|0|0|0|0|0|0|0|0|0|0|0|0|1|0|RT @pension_fond: "РИА Новости", 30.05.2013, интервью Председателя Правления ПФР А. Дроздова http://t.co/tp0Z1KSrvW 
<MintrudRF>|2013-05-30|18:40:17|0|0|0|0|0|0|0|0|0|0|0|0|0|3|0|0|Директор департамента С. Нечаева на "Россия 24" - о разработке госстандартов услуг, оказываемых службой занятости http://t.co/4n3skHhyQo 
<MintrudRF>|2013-05-30|18:58:10|0|0|0|0|0|0|0|0|0|0|1|0|0|1|0|0|Вельмяйкин: Планируется переход возмещения «досрочного» периода выплаты пенсии в систему социального страхования http://t.co/jGp8yd3kt2 
<MintrudRF>|2013-06-01|08:21:05|0|0|0|0|0|0|0|0|0|0|0|0|1|1|0|0|1 июня отмечается Международный день защиты детей http://t.co/Yzyba155ll 
<MintrudRF>|2013-06-01|08:23:47|0|0|0|1|0|0|0|0|0|0|0|0|1|8|0|0|Министр М. Топилин: в России - 28 млн детей, и число рождений растет: если в 2006 г. родилось почти 1,5 млн детей, то в 2012 г. уже 1,9 млн |России
<MintrudRF>|2013-06-01|08:25:12|0|0|0|0|0|0|0|0|0|0|0|0|1|6|0|0|Министр М. Топилин:  В 2012 г. на одну женщину репродуктивного возраста приходилось 1,7 ребенка, тогда как в 2006 г. – только 1,3. 
<MintrudRF>|2013-06-01|08:27:47|0|0|0|6|0|0|0|0|0|0|0|0|0|3|0|0|Россия опережает Австрию, Герм., Грецию, Данию, Испанию, Италию, Португал., Швейцар., в кот. суммар. коэфф. рождаемости - 1,4 – 1,5 ребенка |Россия|Австрию|Грецию|Данию|Испанию|Италию
<MintrudRF>|2013-06-01|08:28:35|0|0|0|0|0|0|0|0|0|0|0|0|2|5|0|0|Министр М. Топилин: По нашим прогнозам, в этом году число родившихся будет на уровне 2011 года – примерно 1,8 млн детей 
<MintrudRF>|2013-06-01|08:42:05|0|0|0|0|0|0|0|0|0|0|0|0|0|0|1|0|RT @KremlinRussia: Вручены ордена «Родительская слава»  http://t.co/oDHwLoC6uV 
<MintrudRF>|2013-06-03|13:36:27|1|0|0|0|0|0|0|0|0|0|0|0|0|6|0|0|Министр М. Топилин - о скидках к страхов. тарифу на обяз. соцстрахование от несчаст. случ. на произв-ве и профзабол. http://t.co/PaD2SgSh1p 
<MintrudRF>|2013-06-03|14:48:55|0|0|0|0|0|0|0|0|0|0|0|0|0|1|0|0|Минтруд не собирается отменять досрочные пенсии "за вредность"  http://t.co/JK7o4JUKAM 
<MintrudRF>|2013-06-03|14:53:07|0|0|0|0|0|0|0|0|0|0|0|0|0|3|0|0|Министр М. Топилин - о вакансиях в органах службы занятости населения http://t.co/JEK23zt11y 
<MintrudRF>|2013-06-03|14:54:51|0|0|0|0|0|0|0|0|0|0|0|0|0|1|0|0|ТОП-10 наиболее востребованных рабочих профессий с высокой зп (по данным госуд. службы занятости )  http://t.co/JEK23zt11y #рыноктруда 
<MintrudRF>|2013-06-03|14:55:54|0|0|0|0|0|0|0|0|0|0|0|0|0|1|0|0|Топ-10 высокооплачиваемых вакансий, заявленных в органы службы занятости http://t.co/JEK23zt11y #рыноктруда 
<MintrudRF>|2013-06-04|11:46:10|0|0|0|1|0|0|0|0|0|0|0|0|1|1|0|0|Министр Максим Топилин: «За январь-апрель 2013 г. в России родились 600,9 тыс. детей» http://t.co/eJVD1sXLUg |России
<MintrudRF>|2013-06-05|20:10:43|0|0|0|1|0|0|0|0|0|0|0|0|0|2|1|0|RT @G20Russia_rus: Вторая встреча рабочей группы по вопросам занятости прошла в Санкт-Петербурге http://t.co/ohp3NozbyE #G20 |Санкт-Петербурге
<MintrudRF>|2013-06-05|21:32:35|0|0|0|0|0|0|0|0|0|0|1|0|0|2|0|0|Подробности с заседания рабочей группы по развитию пенсионной системы http://t.co/11zGwbZZnC  #пенсии 
<MintrudRF>|2013-06-06|18:09:26|0|0|0|0|0|0|0|0|0|0|0|0|0|1|0|0|Поздравление Министра Максима Топилина с Днем социального работника http://t.co/qYrueYBsMt 
<MintrudRF>|2013-06-06|18:37:04|0|0|0|0|0|0|0|0|0|0|0|0|1|3|0|0|Министр М. Топилин - о росте заработной платы социальных работников в I квартале 2013 года http://t.co/45i23G05Qi 
<MintrudRF>|2013-06-06|18:40:44|0|0|1|0|0|0|0|1|0|0|0|0|0|1|0|0|По данным Росстата, средняя заработная плата социальных работников выросла до 12,3 тысячи рублей http://t.co/BAxkdZUPbi 
<MintrudRF>|2013-06-06|18:42:46|0|0|0|0|0|0|0|0|0|0|0|0|1|5|0|0|Заработная плата соцработников в I квартале этого года: 30 регионов уже выполнило параметры, которые были установлены на год 
<MintrudRF>|2013-06-06|19:35:33|0|1|0|0|0|0|0|0|0|0|0|0|0|1|0|0|Накануне Дня социального работника в Минтруде наградили лучших работников учреждения социального обслуживания http://t.co/zcsS2W0FHR 
<MintrudRF>|2013-06-07|13:13:30|0|0|0|0|0|0|0|0|0|0|0|0|0|2|0|0|Министр Максим Топилин: за месяц численность официально зарегистрированных безработных снизилась на 4,3% http://t.co/Wehee3QVW5 
<MintrudRF>|2013-06-10|14:27:42|0|0|0|0|0|0|0|0|0|0|0|0|1|2|0|0|Определены номинации Всероссийского конкурса профессионального мастерства #ЛучшийПоПрофессии на 2013 год http://t.co/x81YTOa6mL 
<MintrudRF>|2013-06-10|17:19:51|0|0|0|0|0|0|0|0|0|0|0|0|0|1|0|0|В Минтруде состоялась встреча с делегацией Китайской федерации инвалидов http://t.co/VTDnJBDdRs 
<MintrudRF>|2013-06-11|17:08:54|0|0|0|0|0|0|0|0|0|0|0|0|1|2|0|0|Определены номинации Всероссийского конкурса профессионального мастерства #ЛучшийПоПрофессии на 2013 год http://t.co/x81YTOa6mL 
<MintrudRF>|2013-06-11|18:22:39|1|0|0|0|0|0|0|0|0|0|0|0|0|0|1|0|RT @G20Russia_rus: Решение проблемы занятости требует интегрированного подхода http://t.co/HNlcDJSsys #G20 
<MintrudRF>|2013-06-13|11:22:59|0|0|0|0|0|0|0|0|0|0|0|0|0|2|0|0|Cостоялось очередное заседание Координационного совета по контролю за реализацией госпрограммы «Доступная среда» http://t.co/QH46erIfO8 
<MintrudRF>|2013-06-14|16:14:00|0|0|0|0|0|0|0|0|0|0|0|0|0|2|0|0|Директор Департамента Григорий Лекарев в интервью "Российской газете-Неделе" рассказал о мерах поддержки глухих http://t.co/aNRR3t7Ph8 
<MintrudRF>|2013-06-18|11:48:39|0|0|0|1|0|0|0|0|0|0|0|0|0|2|0|0|Сегодня Министр М. Топилин находится с визитом в Республике Татарстан. Правительственную делегацию возглавляет вице-премьер О. Голодец |Татарстан
<MintrudRF>|2013-06-18|17:21:13|0|0|0|0|0|0|0|0|0|0|0|0|0|3|0|0|Замминистра Т. Блинова провела окружное совещание в ЮФО по содействию занятости инвалидов и молодых мам http://t.co/WBTS2U2orW 
<MintrudRF>|2013-06-18|17:22:57|0|0|0|0|0|0|1|0|0|0|1|0|0|7|0|0|Замминистра Т. Блинова: "Женщина с детьми должна быть уверена в том, что она будет востребована на рынке труда" http://t.co/4x1F3cNijY 
<MintrudRF>|2013-06-18|19:58:32|0|0|0|1|0|0|0|0|0|0|0|0|0|1|0|0|Подробности рабочей поездки Министра М. Топилина в Республику Татарстан http://t.co/E1euaNxMgw #инвалиды #рыноктруда #доступнаясреда |Татарстан
<MintrudRF>|2013-06-19|15:03:09|0|0|0|0|0|0|0|0|0|0|0|0|0|2|0|0|Директор Департамента Светлана Нечаева рассказала о возможностях трудоустройства женщин с детьми http://t.co/0rLWC7icMF 
<MintrudRF>|2013-06-19|15:03:46|0|0|0|0|0|0|0|0|0|0|0|0|1|3|0|0|20 июня Министр М. Топилин - на #SPIEF2013. Он выступит на панельной дискуссии по занятости http://t.co/lyhlm3tsZM 
<MintrudRF>|2013-06-19|15:04:23|0|0|0|0|0|0|0|0|0|0|1|0|0|2|0|0|Замминистра Татьяна Блинова: «У инвалидов должен быть доступ на инклюзивный рынок труда» http://t.co/ZpyGBHII2h 
<MintrudRF>|2013-06-19|15:08:00|0|0|0|0|0|0|0|0|0|0|0|0|0|2|0|0|Любовь Ельцова рассказала о предложениях Минтруда ограничить размеры выплат при увольнении топ-менеджеров госкомпаний http://t.co/8hoP0o8pBN 
<MintrudRF>|2013-06-19|17:22:10|0|0|0|1|0|0|0|0|0|0|0|0|0|0|0|0|Минтруд представил Демографический атлас России http://t.co/l0Cr6nBrnk |России
<MintrudRF>|2013-06-19|18:08:30|0|0|0|0|0|0|0|0|0|0|0|0|0|2|0|0|Сегодня в 22.10 Министр Максим Топилин - в эфире "Эха Москвы". Тема беседы - "Социальная политика: кого защищает государство?" 
<MintrudRF>|2013-06-20|13:07:49|0|0|0|1|0|0|0|0|0|0|1|0|0|2|0|0|Министр Максим Топилин в интервью радио "Эхо Москвы" рассказал о социальной политике России http://t.co/727988lZUA |России
<MintrudRF>|2013-06-20|14:44:15|0|0|0|0|0|0|0|0|0|0|0|0|0|0|0|0|Министр Топилин дает интервью Russia Today #spied 2013 http://t.co/9yVzbAg0az 
<MintrudRF>|2013-06-20|16:38:07|0|0|0|0|0|0|0|0|0|0|0|0|0|0|0|0|В прямом эфире "Дождя"  #spief2013 http://t.co/uh8nbNfu19 
<MintrudRF>|2013-06-20|16:44:10|0|0|0|0|0|0|0|0|0|0|1|0|0|1|0|0|Министр Максим Топилин комментирует ситуацию на рынке труда "России 1" #spief2013 http://t.co/s381OMnAqe 
<MintrudRF>|2013-06-20|16:47:33|0|0|0|0|0|0|0|0|0|0|0|0|0|3|0|0|Министр Топилин - о пенсионной реформе в интервью "Россия 24" http://t.co/0rQ3IpBwwe 
<MintrudRF>|2013-06-20|18:24:51|0|0|0|1|0|0|0|0|0|0|1|0|0|1|1|0|RT @Pravitelstvo_RF: Дмитрий Медведев встретился с председателем правления Пенсионного фонда России Антоном Дроздовым http://t.co/c33jcdsD6V |России
<MintrudRF>|2013-06-20|23:46:51|0|0|0|0|0|0|0|0|0|0|0|0|1|3|0|0|М. Топилин: Россияне, которые начнут работать с 2015 г., смогут выбрать размер тарифа на накопительную часть пенсии http://t.co/n8VJt7elPL 
<MintrudRF>|2013-06-20|23:49:19|0|0|0|1|0|0|0|0|0|0|0|0|1|2|0|0|Министр Максим Топилин: Минтруда России предлагает продлить на год программу софинансирования пенсии http://t.co/7j803ioeii |России
<MintrudRF>|2013-06-21|12:32:54|0|0|0|0|0|0|0|0|0|0|0|0|0|2|0|0|Министр Максим Топилин в интервью "России 24" рассказал о пенсионной реформе #SPIEF2013 http://t.co/OxVHvKY2Rk 
<MintrudRF>|2013-06-21|12:54:56|0|0|0|0|0|0|0|0|0|0|0|0|0|1|0|0|Министр Максим Топилин в интервью телеканалу "Дождь" озвучил основные направления пенсионной реформы #SPIEF2013 http://t.co/EptQRX5S0z 
<MintrudRF>|2013-06-21|13:07:29|0|0|0|0|0|0|0|0|0|0|0|0|0|2|0|0|Министр Максим Топилин - в прямом эфире "Коммерсант ФМ" #SPIEF2013 http://t.co/rE8DXFVwKf 
<MintrudRF>|2013-06-25|09:45:20|0|0|0|0|0|0|0|0|0|0|0|0|0|0|0|0|Идет он-лайн-трансляция презентации пенсионного калькулятора http://t.co/Lfv0wpU36J 
<MintrudRF>|2013-06-25|12:25:48|0|0|0|0|0|0|0|0|0|0|0|0|0|2|0|0|Идет он-лайн-трансляция слушаний в Общественной палате по пенсионной формуле http://t.co/98c185c5Nd 
<MintrudRF>|2013-06-25|12:56:34|0|0|0|0|0|0|0|0|0|0|0|0|0|0|0|0|Министр Максим Топилин представляет новую пенсионную формулу http://t.co/tBL06qtYbs 
<MintrudRF>|2013-06-25|16:10:18|0|0|0|0|0|0|0|0|0|0|0|0|0|1|0|0|Министр М. Топилин представил новую пенсионную формулу и пенсионный калькулятор (полное видео презентации) #пенсии http://t.co/uYM3r8uW2Q 
<MintrudRF>|2013-06-25|17:42:36|0|0|1|0|0|0|0|0|0|0|0|0|0|1|0|0|Репортаж НТВ о пенсионном калькуляторе http://t.co/J2GoAFDG2x 
<MintrudRF>|2013-06-25|21:06:49|0|0|0|1|0|0|0|0|0|0|1|0|1|1|0|0|В рамках Открытого правительства эксперты оценили план деятельности Минтруда России до 2018 года http://t.co/HcIAsO7MRo |России
<MintrudRF>|2013-06-26|09:59:03|0|0|0|0|0|0|0|0|0|0|0|0|0|3|0|0|Пенсионный калькулятор – http://t.co/aScXjrRlSt. Вы можете рассчитать размер вашей будущей пенсии по новой и действующей формулам #пенсии 
<MintrudRF>|2013-06-26|11:59:58|0|0|0|0|0|0|0|0|0|0|0|0|0|1|0|0|Стенограмма пресс-конференции, посвященной презентации новой пенсионной формулы и пенсионного калькулятора http://t.co/XOO0bWzqPj #пенсии 
<MintrudRF>|2013-06-26|14:23:59|0|0|0|0|0|0|0|1|0|0|0|0|1|3|0|0|Министр Топилин: 1 млрд руб. будет направлен на оборудование спортивных объектов для нужд #инвалиды в 2014-2015 годах http://t.co/x5gBfpWCRa 
<MintrudRF>|2013-06-27|11:27:46|0|0|0|0|0|0|0|0|0|0|0|0|0|2|0|0|Замминистра Андрей Пудов в программе "Утро России" канала "Россия 1" рассказал о новых пенсионных правилах http://t.co/4e8Wsv5hV5 
<MintrudRF>|2013-06-27|11:28:24|0|0|0|0|0|0|0|0|0|0|0|0|0|1|0|0|Работодатели смогут  использовать результаты производственного контроля для целей  специальной оценки условий труда http://t.co/DKnc6HcYDD 
<MintrudRF>|2013-06-27|11:29:33|0|0|0|0|0|0|0|0|0|0|0|0|0|2|0|0|Представитель ПФР Маргарита Нагога  на канале "ТВЦ" рассказала, как воспользоваться пенсионным  калькулятором http://t.co/lnP2aWpZtZ 
<MintrudRF>|2013-06-27|13:02:08|0|0|0|1|0|0|0|0|0|0|0|0|0|1|0|0|Министр М.Топилин представит План Минтруда России на 2013-2018 гг. Прямая трансляция на канале "Россия 24"  http://t.co/0rzjvVj9Cc |России
<MintrudRF>|2013-06-27|18:01:51|0|0|0|1|0|0|0|0|0|0|0|0|0|2|0|0|Выступление Министра М.Топилина на заседании Правительства РФ по Планам деятельности Минтруда России на 2013-2018 гг. http://t.co/Is3jIJRBVV |России
<MintrudRF>|2013-06-27|18:19:11|0|0|0|0|0|0|0|0|0|0|0|0|1|2|0|0|План деятельности Министерства труда и социальной защиты РФ на 2013-2018 годы http://t.co/c7BK7vxsyc. Предлагайте свою цель! 
<MintrudRF>|2013-06-27|18:26:59|0|0|0|0|0|0|0|0|0|0|1|0|0|2|0|0|Роструд создаст «Трудовой навигатор» – справочник по основным вопросам трудового законодательства http://t.co/LwHcJnpg3z 
<MintrudRF>|2013-07-01|11:41:33|0|0|0|0|0|0|0|0|0|0|0|0|0|4|0|0|Пенсии россиян будут рассчитываться по новой формуле - сюжет в программе "Воскресное время" на "Первом канале" http://t.co/hsI9e2c5Za 
<MintrudRF>|2013-07-01|13:23:15|0|0|0|0|0|0|0|0|0|0|0|0|0|1|0|0|Более 700 тысяч просмотров за неделю набрал пенсионный калькулятор http://t.co/NZRYITYYnE 
<MintrudRF>|2013-07-01|13:26:56|0|0|0|0|0|0|0|0|0|0|0|0|0|1|0|0|В интервью радио "Вести FM" статс-секретарь-замминистра Андрей Пудов рассказал о новых пенсионных правилах http://t.co/GN2YDWH5G5 
<MintrudRF>|2013-07-01|15:16:55|0|0|0|0|0|0|0|0|0|0|0|0|1|2|1|0|RT @pension_fond: 1 июля – начало отчетной кампании для плательщиков страховых взносов http://t.co/VDMORRjWAi 
