<MintrudRF>|2013-02-21|17:53:54|0|0|0|0|0|0|0|0|0|0|0|0|0|1|1|0|RT @pension_fond: Распоряжение средствами материнского капитала временем не ограничено… http://t.co/Zt7MAg3OhG 
<MintrudRF>|2013-02-21|22:04:44|0|0|0|0|0|0|0|0|0|0|0|0|0|2|1|0|RT @G20Russia_rus: Завершился первый день заседания Рабочей группы по вопросам занятости http://t.co/plPqfjN1iN #G20 
<MintrudRF>|2013-02-22|09:38:58|0|0|0|0|0|0|0|0|0|0|0|0|0|2|0|0|Дир. деп-та Д. Баснак: Минтруд запускает 4 пилотных проекта по внедрению современ. кадровых технологий на #госслужба http://t.co/qVGkkWKEPo 
<MintrudRF>|2013-02-22|21:48:00|0|0|0|0|0|0|0|0|0|0|1|0|0|1|0|0|Министр М. Топилин: У Минтруда в проекте 60 законов http://t.co/GbubYwaqw5 
<MintrudRF>|2013-02-25|16:58:56|0|0|0|0|0|0|0|0|0|0|0|0|0|3|1|0|RT @KremlinRussia: Внесены изменения в отдельные законодательные акты по вопросу рабочих мест для инвалидов http://t.co/UYkGt4Bsal 
<MintrudRF>|2013-02-25|17:40:15|0|1|0|1|0|0|0|0|0|0|0|0|0|1|0|0|Новый, исчерпывающий, перечень уважительных причин неявки в центр занятости населения http://t.co/gETPOgu1pG #занятость #рыноктруда |Новый Орлеан
<MintrudRF>|2013-02-26|13:22:40|1|0|0|0|0|0|0|0|0|0|0|0|0|3|0|1|@balodya74 Уточните, о чем речь: вредные и опасные условия труда, педвыслуга, медвыслуга? 
<MintrudRF>|2013-02-26|18:30:52|0|0|0|0|0|0|0|0|0|0|0|0|0|1|0|0|Замминистра Т. Блинова ответила на вопросы слушателей прямой линии члена @op_rf Д. Гурцкая http://t.co/RpsGpNaLMs #инвалиды #рыноктруда 
<MintrudRF>|2013-02-27|09:37:00|0|0|0|0|0|0|0|0|0|0|1|1|0|3|0|0|Выступление министра М. Топилина на заседании Совета по реализ. приорит. нацпроектов и демограф. политике http://t.co/IZtG7cwH8R #демография 
<MintrudRF>|2013-02-27|09:38:05|0|0|0|0|0|0|0|0|0|0|1|0|0|2|1|0|RT @KremlinRussia: Заседание Совета по реализации приоритетных национальных проектов и демографической политике http://t.co/rLOO3VBeYj 
<MintrudRF>|2013-02-27|09:41:47|0|0|0|0|0|0|0|0|0|0|0|0|0|1|0|1|@sobol20846 Обратитесь в трудовую инспекцию. Контакты http://t.co/zw8tcuWmYY 
<MintrudRF>|2013-02-27|10:32:03|0|0|0|0|0|0|0|0|0|0|0|0|0|2|0|1|@sobol20846 Ваше заявление приняли, зарегистрировали и не было реакции? 
<MintrudRF>|2013-02-27|13:18:02|0|0|0|0|0|0|0|0|0|0|0|0|0|2|0|1|@sobol20846 Напишите заявление. Можете написать и в Роструд http://t.co/TdLjytPlVH 
<MintrudRF>|2013-02-27|15:42:19|0|0|0|0|0|0|0|0|0|0|1|0|0|2|0|0|Министр Максим Топилин – о независимой системе оценки качества работы организаций, оказывающих социальные услуги http://t.co/UXyIx2PiA7 
<MintrudRF>|2013-02-27|15:55:12|0|0|0|0|0|0|0|0|0|0|0|0|0|2|0|0|Приглашаем к обсужд. проекта постановл. Правительства РФ по независ. сис-ме оценки качества работы организ. соцсферы http://t.co/jJ40FwswwH 
<MintrudRF>|2013-02-28|19:18:59|0|0|0|0|0|0|0|0|0|0|0|0|0|2|0|0|На заседании Правительства РФ одобрены поправки Минтруда, запрещающие публикацию объявлений о вакансиях с указанием возраста 
<MintrudRF>|2013-02-28|19:20:22|0|0|0|0|0|0|0|0|0|0|1|0|0|3|0|0|Тем же законопроектом дается право регионам организовывать профобучение для пенсионеров через центры занятости населения 
<MintrudRF>|2013-03-01|10:44:51|0|0|0|0|0|0|0|0|0|0|0|0|0|2|0|0|Замминистра А. Вовченко на заседании росс. трехсторон. комиссии: #законосоцобслуживании одобрен профсоюзами и работодателями 
<MintrudRF>|2013-03-01|10:50:08|0|0|0|0|0|0|0|0|0|0|0|0|0|1|0|0|А. Вовченко: #законосоцобслуживании прошел широкое обществ. обсуждение. Важный принцип — индивидуальный подход к оказанию соцпомощи человеку 
<MintrudRF>|2013-03-04|11:44:27|0|0|0|0|0|0|0|0|0|0|0|1|0|2|0|0|Сегодня министр М. Топилин в составе делегации под руководством вице-премьера О. Голодец посещает Белгородскую область 
<MintrudRF>|2013-03-04|11:46:00|0|0|0|0|0|0|1|0|0|0|0|0|0|5|0|0|77% инвалидов заявили о том, что они хотят трудоустроиться и продолжать трудовую деятельность http://t.co/oxBf0u0LhQ #инвалиды #рыноктруда 
<MintrudRF>|2013-03-04|11:50:05|0|0|0|0|0|0|0|0|0|0|0|0|0|4|0|0|Директор департамента развития госслужбы Д. Баснак - о работе по #антикоррупция на #госслужба http://t.co/WyTzRVgUSB 
<MintrudRF>|2013-03-04|18:54:56|0|0|0|0|0|0|0|0|0|0|0|0|0|1|0|0|Сергей Вельмяйкин назначен первым заместителем Министра труда и социальной защиты РФ http://t.co/2Oc9bh2lNB 
<MintrudRF>|2013-03-04|18:58:37|0|0|0|0|0|0|0|0|0|0|0|0|0|1|1|0|RT @OpenGovtRussia: Дмитрий БАСНАК  о стандарте открытости деятельности органов исполнительной власти: http://большоеправительство.рф/blogs/post/5175/ 
<MintrudRF>|2013-03-05|11:19:17|0|0|0|0|0|0|0|0|0|0|0|0|0|3|0|0|Замминистра Любовь Ельцова – о #МРОТ в комментарии газете «Московские новости» http://t.co/sxN8xa1hNk #заработнаяплата 
<MintrudRF>|2013-03-05|18:13:49|0|0|0|0|0|0|0|0|0|0|0|0|1|1|0|0|Численность официально зарегистрированных безработных на конец февраля составила 1 млн 105 тысяч человек http://t.co/E5WLMbDeWn #рыноктруда 
<MintrudRF>|2013-03-06|18:10:29|0|0|0|0|0|0|0|0|0|0|0|0|0|1|0|0|Замминистра А. Вовченко провел переговоры с заместителем Генерального директора МОТ Сандрой Поласки http://t.co/UCX6izCRPD 
<MintrudRF>|2013-03-06|18:13:06|0|1|0|0|0|0|0|0|0|0|0|0|0|1|0|0|Председатель Правительства РФ Д. Медведев принял участие в праздничном мероприятии в Минтруде http://t.co/ZZ7LsFIehr #инвалиды #соцсфера 
<MintrudRF>|2013-03-07|14:52:58|0|0|0|1|0|0|0|0|0|0|0|0|0|3|0|0|Обсуждение подходов к новой пенсионной формуле в Минтруде России в предпраздничный день  #пенсии http://t.co/uiCd6c2DOG |России
<MintrudRF>|2013-03-07|14:54:58|0|0|0|0|0|0|0|0|0|0|0|0|0|3|0|0|Статс-секретарь - замминистра А. Пудов и эксперты поясняют журналистам подходы к новой пенсионной формуле #пенсии http://t.co/P7QaiPmZbu 
<MintrudRF>|2013-03-07|17:01:34|0|0|0|0|0|0|0|0|0|0|0|0|0|3|0|0|Министр М.Топилин: Правительством одобрен законопроект о ратифик. Конвенции о безопасности и гигиене труда на шахтах http://t.co/tbmoRsGbqa 
<MintrudRF>|2013-03-07|17:09:07|0|0|0|0|0|0|0|0|0|0|0|0|0|3|0|0|Директор департамента Д. Баснак рассказал "Вести ФМ" о рекомендациях по #антикоррупция на #госслужба http://t.co/TBV2ZLKtfL 
<MintrudRF>|2013-03-07|17:32:22|0|0|0|0|0|0|0|0|0|0|0|0|0|3|0|1|@ellbel38 Проекты документов - в Банке документов на сайте http://t.co/YxApNJvKua В поисковой форме следует указать вид документа "проект" 
<MintrudRF>|2013-03-07|17:35:29|0|0|0|0|0|0|0|0|0|0|0|0|0|2|0|0|Эксперты и Минтруд обсудили подходы к новой пенсионной формуле #пенсии http://t.co/LRZFCUYGrV 
<MintrudRF>|2013-03-13|16:19:55|0|0|0|0|0|0|0|0|0|0|1|0|0|2|0|0|Максим Топилин в ходе «Делового завтрака» в «Российской газете» рассказал о перспективах развития пенсионной системы http://t.co/1FpSfLxPsO 
<MintrudRF>|2013-03-13|17:44:25|0|0|0|1|0|0|0|0|0|0|0|0|2|1|0|0|В январе 2013 года в России родились 158,9 тыс. детей http://t.co/UYGAwWAcQ0 |России
<MintrudRF>|2013-03-14|16:33:00|0|0|0|0|0|0|0|0|0|0|0|0|0|1|0|0|Министр Максим Топилин рассказал о тонкостях новой пенсионной формулы http://t.co/FW0tDpgtsN 
<MintrudRF>|2013-03-14|17:54:22|0|0|0|1|0|0|0|0|0|0|0|0|0|1|0|0|В Минтруд России начали поступать заявки на разработку профессиональных стандартов http://t.co/Tyj1MQgSXG |России
<MintrudRF>|2013-03-15|12:24:05|0|0|0|0|0|0|0|0|0|0|0|0|0|2|0|0|Министр Максим Топилин рассказал «Московскому комсомольцу» о работе и отдыхе, карьере и семье http://t.co/t9OxH34LmS 
<MintrudRF>|2013-03-15|12:25:44|0|0|0|0|0|0|0|0|0|0|0|0|0|0|1|0|RT @pension_fond: Интервью Первого заместителя Председателя Правления ПФР Л.И. Чижик "Комсомольской правде"… http://t.co/l7WTjPL6Gk 
<MintrudRF>|2013-03-15|12:27:30|0|0|0|0|0|0|0|0|0|0|1|0|0|0|0|0|На вопросы читателей «Комсомольской правды» ответила первый зампредседателя правления ПФР Лилия Чижик http://t.co/gKPaL4yXB7 
<MintrudRF>|2013-03-15|12:30:46|0|0|0|0|0|0|0|0|0|0|1|0|0|2|1|0|RT @Pravitelstvo_RF: О Правилах представления сведений о доходах лицом, поступающим на работу руководителем федерального госучреждения http://t.co/fQi6Y9dlAX 
<MintrudRF>|2013-03-15|12:30:51|0|0|0|0|0|0|0|0|0|0|2|0|0|2|1|0|RT @Pravitelstvo_RF: О Правилах проверки сведений о доходах граждан, претендующих на должности руководителей федеральных госучреждений http://t.co/Clx2FsvtFK 
<MintrudRF>|2013-03-18|16:16:01|0|0|0|0|0|0|0|0|0|0|1|0|0|1|0|0|Замминистра Алексей Вовченко рассказал журналу "Эксперт" о развитии системы социального обслуживания http://t.co/Vp1njjm3gd 
<MintrudRF>|2013-03-19|11:07:02|0|0|0|0|0|0|0|0|0|0|0|0|0|2|0|0|Замминистра Любовь Ельцова примет участие в совещании по вопросу создания базового центра профподготовки в РСПП http://t.co/zKQVfvIoog 
<MintrudRF>|2013-03-19|11:44:04|0|0|0|1|0|0|0|0|0|0|0|0|0|1|0|0|В Минтруд России продолжают поступать заявки на разработку профессиональных стандартов http://t.co/0AlmjPBSsV |России
<MintrudRF>|2013-03-19|12:24:52|0|0|0|0|0|0|0|0|0|0|0|0|0|1|0|0|Законопроект "Об основах социального обслуживания" одобрен комиссией Правительства РФ по законопроектной деятельности http://t.co/3IEn9A6gBT 
<MintrudRF>|2013-03-20|11:31:26|0|0|0|0|0|0|0|0|0|0|1|0|0|1|0|0|Директор Департамента Валерий Корж принял участие в видеомосте «Будущее системы охраны труда в России» http://t.co/mXYJ0BaNYk 
<MintrudRF>|2013-03-20|11:33:15|0|0|0|0|0|0|0|0|0|0|1|0|0|3|1|0|RT @Pravitelstvo_RF: Поручения министерствам по итогам встречи Председателя Правительства с социальными работниками и педагогами http://t.co/SbiLB7AZaV 
<MintrudRF>|2013-03-20|11:33:21|0|0|0|0|0|0|0|0|0|0|1|0|0|1|1|0|RT @Pravitelstvo_RF: О законопроекте, направленном на развитие системы социального обслуживания населения http://t.co/XIG0eBy6DF 
<MintrudRF>|2013-03-20|14:44:18|0|0|0|1|0|0|0|0|0|0|0|0|0|1|0|0|Минтруда России прорабатывает подходы к созданию базового центра профподготовки рабочих кадров http://t.co/7LFf25GWVy |России
<MintrudRF>|2013-03-22|09:58:30|0|0|0|1|0|0|0|0|0|0|0|0|0|2|0|0|Минтруд России разработал Комплекс мер по привлечению госслужащих к противодействию коррупции http://t.co/xqi4RETZN9 |России
<MintrudRF>|2013-03-22|09:59:34|0|0|0|0|0|0|0|0|0|0|1|0|0|1|0|0|Началась работа по формированию независимой системы оценки качества работы организаций, оказывающих соцуслуги http://t.co/b0fBAdF1x4 
<MintrudRF>|2013-03-22|10:00:17|0|0|0|0|0|0|0|0|0|0|0|0|0|3|0|0|Министр Максим Топилин на заседании Правительства доложил о законопроекте об основах социального обслуживания http://t.co/Sm5PHgkjRl 
<MintrudRF>|2013-03-23|11:03:54|0|0|0|0|0|0|0|0|0|0|0|0|0|0|0|0|Сегодня празднует 100-летний юбилей экс-Министр соцобеспечения, зампредседателя Совета Министров РСФСР Лидия Лыкова http://t.co/kIV8Mnrxfl 
<MintrudRF>|2013-03-23|15:08:57|0|0|0|0|0|0|0|0|0|0|0|0|0|2|0|0|Максим Топилин поздравил со 100-летним юбилеем и наградил Лыкову Лидию  Павловну http://t.co/H8KwTOtuud 
<MintrudRF>|2013-03-24|18:01:10|0|0|0|0|0|0|0|0|0|0|1|0|1|2|0|0|Руководители государственных учреждений должны представить сведения о доходах не позднее 30 апреля http://t.co/uwOeM9Y96T 
<MintrudRF>|2013-03-25|12:52:45|0|0|0|1|0|0|0|0|0|0|0|0|0|0|0|0|Андрей Кигим назначен председателем Фонда социального страхования Российской Федерации http://t.co/YLplHV0aMK |Российской Федерацией
<MintrudRF>|2013-03-25|12:54:22|0|0|0|1|0|0|0|0|0|0|0|0|0|2|0|0|Минтруд России составит рейтинг региональных отделений ПФР и ФСС по качеству предоставления социальных услуг http://t.co/m8mLt7AHg9 |России
<MintrudRF>|2013-03-26|15:51:35|0|0|0|1|0|0|0|0|0|0|0|0|0|1|0|0|Министр Максим Топилин выступил на заседании Правления ПФР России @pension_fond #пенсии http://t.co/BaSQlwnywm |России
<MintrudRF>|2013-03-26|15:59:41|0|0|0|1|0|0|0|0|0|0|0|0|0|1|0|0|Фоторепортаж с расширенного заседания Правления Пенсионного фонда России @pension_fond  http://t.co/lLsNhXfd3O |России
<MintrudRF>|2013-03-26|16:06:02|0|0|0|0|0|0|0|0|0|0|0|0|0|1|0|1|@Alexandr19822 Обратитесь в трудовую инспекцию http://t.co/zw8tcuWmYY 
<MintrudRF>|2013-03-26|17:16:56|0|0|0|1|0|0|0|0|0|0|0|0|0|1|0|0|В Минтруд России поступили новые заявки на разработку профессиональных стандартов http://t.co/hnsuyQGG50 |России
<MintrudRF>|2013-03-27|09:42:59|0|0|0|0|0|0|0|0|0|0|0|0|1|1|1|0|RT @pension_fond: В 2012 году к Программе государственного софинансирования пенсии присоединились 3,6 млн. человек 
<MintrudRF>|2013-03-27|11:21:42|0|0|0|2|0|0|0|0|0|0|0|0|0|1|0|0|Под эгидой Минтруда России в Санкт-Петербурге открылся Международный форум «Старшее поколение» http://t.co/6nez295Zbg |России|Санкт-Петербурге
<MintrudRF>|2013-03-27|13:16:32|0|0|0|1|0|0|0|0|0|0|0|0|0|1|0|0|Минтруд России подготовил проект постановления Правительства РФ «О переносе выходных дней в 2014 году» http://t.co/OTRCaA7DxF |России
<MintrudRF>|2013-03-28|14:50:37|0|0|0|0|0|0|0|0|0|0|0|0|0|3|0|0|Законопроект об обустройстве рабочих мест для инвалидов рассмотрен на заседании Правительства РФ http://t.co/2DtMKCCrX6 
<MintrudRF>|2013-03-29|17:44:42|0|0|0|1|0|0|0|0|0|0|0|0|0|1|1|0|RT @KremlinRussia: Владимир Путин подписал указ об установлении звания Героя Труда http://t.co/ENUqOdrKv6 |Владимир
<MintrudRF>|2013-04-01|13:37:53|0|0|0|0|0|0|0|0|0|0|0|0|2|0|0|0|1 апреля 2013 года произведена индексация пенсий http://t.co/xWq8UD3y4O 
<MintrudRF>|2013-04-01|16:22:49|0|0|0|0|0|0|0|0|0|0|0|0|0|3|0|0|Минтруд начинает отбор организаций инвалидов для предоставления субсидий на программы по трудоустройству инвалидов http://t.co/fA2eGX5445 
<MintrudRF>|2013-04-03|14:44:42|0|0|0|1|0|0|0|0|0|0|0|0|0|1|0|0|Министр Максим Топилин принял участие в заседании Правления Фонда социального страхования России http://t.co/EPpmG3zvHN |России
<MintrudRF>|2013-04-04|18:17:11|0|0|0|0|0|0|0|0|0|0|1|0|0|1|0|0|Около 210 тысяч руководителей бюджетных учреждений впервые отчитаются о своих доходах http://t.co/NkWCj1TLQb 
<MintrudRF>|2013-04-04|18:19:16|0|0|0|0|0|0|0|0|0|0|0|0|0|2|0|0|Пресс-конференция замминистра Алексея Вовченко на тему "Социальная поддержка семей при рождении третьего ребенка" http://t.co/VKbnQdQKxw 
<MintrudRF>|2013-04-04|18:49:34|0|0|0|1|0|0|0|0|0|0|0|0|2|1|0|0|12 апреля 2013 года в Правительстве РФ состоится расширенное заседание Коллегии Минтруда России http://t.co/lb0FaTQdw7 |России
<MintrudRF>|2013-04-05|11:17:22|0|0|0|0|0|0|0|0|0|0|0|0|2|1|0|0|Численность официально зарегистрированных безработных на конец марта 2013 года снизилась на 1,75% http://t.co/KLCMS6h1br 
<MintrudRF>|2013-04-05|12:57:34|0|0|0|1|0|0|0|0|0|0|0|0|0|1|0|0|В Минтруд России поступили новые заявки на разработку профессиональных стандартов http://t.co/LFe8SdbxK7 |России
<MintrudRF>|2013-04-05|14:05:41|0|0|0|1|0|0|0|0|0|0|0|0|0|3|0|0|На Экспертном совете по профстандартам при Минтруде России одобрены макет профстандарта и уровни квалификации http://t.co/n5AChvD1eX |России
<MintrudRF>|2013-04-06|22:06:26|0|0|0|0|0|0|0|0|0|0|0|0|0|2|0|0|Всеволод Вуколов назначен руководителем Федеральной службы по труду и занятости http://t.co/YZa1giZwN0 
<MintrudRF>|2013-04-08|16:02:26|0|0|0|1|0|0|0|0|0|0|0|0|0|1|0|0|Сегодня начинается визит Министра М. Топилина в Норвегию. Он примет участие в 9 Европейском рег. совещании Междун. организации труда |Норвегию
<MintrudRF>|2013-04-08|17:55:06|0|0|0|2|0|0|0|0|0|0|0|0|0|2|0|0|Министр М. Топилин возложил венок к монументу павшим советским солдатам на кладбище "Вестре Гравлюнд", Осло, Норвегия http://t.co/BoN70GKvgX |Осло|Норвегия
<MintrudRF>|2013-04-08|18:04:04|0|0|0|0|0|0|0|0|0|0|0|1|0|2|0|0|Сегодня М. Топилин примет участие в неформ. встрече министров труда в рамках Европейского рег. совещ. МОТ. На повестке - занятость молодежи. 
<MintrudRF>|2013-04-09|13:05:48|0|0|0|0|0|0|0|0|0|0|0|0|0|2|0|0|Министр М. Топилин встретился с Генеральным директором МОТ Гаем Райдером. Стороны обсудили повестку G20 и ход совместной программы РФ и МОТ 
<MintrudRF>|2013-04-09|13:23:15|0|0|0|1|0|0|1|0|0|0|1|0|0|3|0|0|Министр М. Топилин и его турецкий коллега Ф. Челик обсудили повестку G20 и вопросы регулирования труда турецких граждан, работающих в России |России
<MintrudRF>|2013-04-09|18:14:14|0|0|0|0|0|0|0|0|0|0|0|0|0|1|0|0|Министр Максим Топилин ответил на вопросы читателей "Российской газеты" http://t.co/pef1S4DeXs #рыноктруда #инвалиды #пенсии 
<MintrudRF>|2013-04-09|18:27:27|0|0|0|0|0|0|0|0|0|0|0|0|0|1|0|0|Подробности встречи Министра М. Топилина и Гендиректора МОТ Гая Райдера http://t.co/WIsh3kCm9R http://t.co/dU26ylHuoZ 
<MintrudRF>|2013-04-09|19:19:50|0|0|0|0|0|0|0|0|0|0|0|0|0|1|0|0|Министр Максим Топилин: Сегодня ключевым должно быть качество образовательных  программ http://t.co/SQWWErKe7s #рыноктруда 
<MintrudRF>|2013-04-09|19:22:14|0|0|0|0|0|0|0|0|0|0|1|0|0|6|0|0|М. Топилин на совещ. МОТ: Необх. повысить качество образоват. программ – это осн. ресурс для того, чтобы сделать экономики более эффектив-ми 
<MintrudRF>|2013-04-09|19:23:41|0|0|0|0|0|0|0|0|0|0|1|0|0|2|0|0|Министр Максим Топилин, говоря о страховых взносах в пенсионную сис-му: Мы должны восстановить солидарность в системе соцстрахования 
<MintrudRF>|2013-04-09|19:35:53|0|0|1|0|0|0|0|0|0|0|1|0|0|2|0|0|Г. Лекарев: Будет организован мониторинг соблюдения обязательств РФ по Конвенции ООН о правах инвалидов http://t.co/j5eZB7ooHA #инвалиды 
<MintrudRF>|2013-04-09|20:05:15|0|0|0|0|0|0|0|0|0|0|0|0|0|1|0|0|Министр Максим Топилин провел двусторонние встречи с европейскими  коллегами http://t.co/nHzwSBQPbZ http://t.co/LxgLV01peL 
<MintrudRF>|2013-04-11|12:18:56|0|0|0|0|0|0|0|1|0|0|1|0|1|2|0|0|В 2013 году будет выделено 3,66 млрд рублей из федерального бюджета на выплаты на третьего ребенка http://t.co/9OA2bS9Jrr 
<MintrudRF>|2013-04-11|12:22:00|0|0|0|0|0|0|0|0|0|0|0|0|0|2|0|0|Минтруд приступил к мониторингу достижения целевых показателей «Дорожной карты» по развитию сферы соцобслуживания http://t.co/7J1HJSgJaA 
<MintrudRF>|2013-04-11|13:25:53|0|0|0|1|0|0|0|0|0|0|0|0|0|3|0|0|Минтруд России начал серию окружных совещаний по развитию занятости инвалидов и женщин с детьми http://t.co/tX5o7v3h70 |России
<MintrudRF>|2013-04-11|15:35:33|0|0|0|0|0|0|0|0|0|0|0|0|0|2|0|0|Пресс-конференция замминистра Алексея Вовченко по ежемесячной денежной выплате на третьего ребенка http://t.co/zSD7y7jlEG 
