name	date	time	negative	positiv	company	geo	me0	me1	me2	money	sure	unsure	termins	polit	dates	irregular	RT	reply	text	geo1	geo2	geo3
<ach_gov_ru>	2010-12-24	16:25:08	0	0	0	0	0	0	0	0	0	0	0	0	0	0	0	0	ПОДРОБНЕЕ http://www.ach.gov.ru/ru/news/24122010-1/ 
<ach_gov_ru>	2010-12-24	16:26:31	0	0	0	0	0	0	0	0	0	0	0	0	0	2	0	0	СП РФ проверила учреждения в сфере образования и науки. 
<ach_gov_ru>	2010-12-24	16:26:53	0	0	0	0	0	0	0	0	0	0	0	0	0	0	0	0	ПОДРОБНЕЕ http://www.ach.gov.ru/ru/news/24122010/ 
<ach_gov_ru>	2010-12-27	11:58:52	0	0	0	2	0	0	0	0	0	0	0	0	0	1	0	0	С.В.Степашин: Счетная палата Российской Федерации проверит эффективность использования средств по жилищной программе Санкт-Петербурга. 	Российской Федерацией	Санкт-Петербурга
<ach_gov_ru>	2010-12-27	12:03:58	0	0	0	1	0	0	0	0	0	0	0	0	0	1	0	0	Помимо проверки эффективности расходования денег по жилищной программе Санкт-Петербурга СП рассмотрит возможность привлечения иных средств. 	Санкт-Петербурга
<ach_gov_ru>	2010-12-27	12:04:40	0	0	0	1	0	0	0	0	0	0	0	1	1	5	0	0	С.В.Степашин: Жилье - одна из главных задач, которые Президент России сформулировал на следующий год. 	России
<ach_gov_ru>	2010-12-27	14:00:42	0	0	0	0	0	0	0	0	0	0	0	0	2	1	0	0	ВНИМАНИЕ СМИ!  Завтра, 28 декабря 2010 года, в здании Счетной (cont) http://tl.gd/7o6fc1 
<ach_gov_ru>	2010-12-27	20:53:48	0	0	0	1	0	0	0	0	0	0	0	0	0	1	0	0	Коллегия Счетной палаты Российской Федерации под (cont) http://tl.gd/7oeftq 	Российской Федерацией
<ach_gov_ru>	2010-12-27	20:54:57	0	0	0	1	0	0	0	0	0	0	0	0	0	1	0	0	Коллегия Счетной палаты Российской Федерации под (cont) http://tl.gd/7oegm5 	Российской Федерацией
<ach_gov_ru>	2010-12-27	20:55:41	0	0	0	1	0	0	0	0	0	0	0	0	0	1	0	0	Коллегия Счетной палаты Российской Федерации под (cont) http://tl.gd/7oeh5o 	Российской Федерацией
<ach_gov_ru>	2010-12-27	20:58:57	0	0	0	1	0	0	0	0	0	0	0	0	0	1	0	0	Коллегия Счетной палаты Российской Федерации под (cont) http://tl.gd/7oej7q 	Российской Федерацией
<ach_gov_ru>	2010-12-27	20:59:01	0	0	0	1	0	0	0	0	0	0	0	0	0	1	0	0	Коллегия Счетной палаты Российской Федерации под (cont) http://tl.gd/7oej9c 	Российской Федерацией
<ach_gov_ru>	2010-12-28	15:20:30	0	0	0	1	0	0	0	1	0	0	1	0	1	3	0	0	На оказание финансовой помощи в 2009 и 2010 годах Республике Абхазия из федерального бюджета предусмотрены 7,3 млрд.руб. 	Абхазия
<ach_gov_ru>	2010-12-28	15:21:45	0	0	0	0	0	0	0	0	0	0	0	0	0	2	0	0	В Республике проделана большая работа по восстановлению и модернизации ЖКХ и транспортной инфраструктуры, по ремонту объектов соцназначения. 
<ach_gov_ru>	2010-12-28	15:22:44	0	0	0	0	0	0	0	0	0	0	0	0	0	2	0	0	В ходе контрольного мероприятия СП РФ выявлены отдельные недостатки и нарушения, которые обусловлены http://www.ach.gov.ru/ru/news/28122010/ 
<ach_gov_ru>	2010-12-28	15:24:11	0	0	0	0	0	0	0	0	0	0	0	0	0	1	0	0	Коллегия СП РФ рассмотрела результаты проверки исполнения представлений принятых по результатам проведенных контрольных мероприятий. 
<ach_gov_ru>	2010-12-28	15:24:49	0	0	0	1	0	0	0	0	0	0	0	0	0	4	0	0	Проверка показала, что Минсельхозом России и Росимуществом не исполнена часть предложений Счетной палаты по «Племенной завод «Пушкинский». 	России
<ach_gov_ru>	2010-12-28	15:25:52	0	0	0	0	0	0	0	0	0	0	0	0	0	4	0	0	Не приняты все необходимые меры к сохранению племенного стада пушных зверей, в том числе «Пушкинского» черного соболя http://goo.gl/nQ1mu 
<ach_gov_ru>	2010-12-28	15:27:12	0	0	0	0	0	0	0	0	0	0	0	0	0	3	0	0	СП РФ заключило Соглашение с «Российской академией народного хозяйства и государственной службы при Президенте России» http://goo.gl/rqpMS 
<ach_gov_ru>	2010-12-28	15:41:09	0	0	0	1	0	0	0	1	0	0	0	0	0	2	0	0	По предварительным данным проверки использования средств на развитие и содержание транспорта Москвы объем нарушений составил 232 млрд.руб. 	Москвы
<ach_gov_ru>	2010-12-28	15:41:37	0	0	0	0	0	0	0	0	0	0	0	0	1	3	0	0	С.Н.Рябухин: Перечень нарушений по транспортному комплексу за последние 3 года достаточно большой и касается бюджетных средств. 
<ach_gov_ru>	2010-12-28	15:41:55	0	0	0	0	0	0	0	0	0	0	0	0	0	4	0	0	С.Н.Рябухин: Данная информация будет направлена в мэрию, а по некоторым эпизодам, получившим квалификацию,  - в прокуратуру. 
<ach_gov_ru>	2010-12-28	16:37:14	0	0	0	1	0	0	0	0	0	0	0	0	0	1	0	0	I uploaded a YouTube video -- Нарушения в транспортном комплексе Москвы http://youtu.be/1zT_j8OeuvQ?a 	Москвы
<ach_gov_ru>	2010-12-29	15:23:17	0	0	0	0	0	0	0	0	0	0	0	0	0	0	0	0	Экспертно-аналитическое мероприятие «Эффективность (cont) http://tl.gd/7plhco 
<ach_gov_ru>	2010-12-29	15:25:25	0	0	0	0	0	0	0	0	0	0	0	0	0	0	0	0	«Проверка эффективности использования бюджетных средств, (cont) http://tl.gd/7plige 
<ach_gov_ru>	2010-12-29	15:27:36	0	0	0	0	0	0	0	0	0	0	1	0	0	3	0	0	«Доступное и комфортное жилье - гражданам России» за 2008-2009 гг. (cont) http://tl.gd/7plji7 
<ach_gov_ru>	2010-12-29	15:29:27	0	0	0	0	0	0	0	0	0	0	0	0	0	0	0	0	ВНИМАНИЕ ПРЕДСТАВИТЕЛЕЙ СРЕДСТВ МАССОВОЙ ИНФОРМАЦИИ!  В ряде (cont) http://tl.gd/7plkfh 
<ach_gov_ru>	2010-12-29	19:01:05	0	0	0	0	0	0	0	0	0	0	0	0	2	3	0	0	Коллегия СП РФ 14 января планирует рассмотреть вопрос о включении в план работы на 2011 г. контрольных мероприятий http://goo.gl/ILjmA 
<ach_gov_ru>	2010-12-30	11:10:14	1	0	0	0	0	0	0	0	0	0	0	0	0	5	0	0	С.В.Степашин: Это безобразие. Безобразием является отношение авиакомпаний к пассажирам. За это надо снимать с должностей и наказывать. 
<ach_gov_ru>	2010-12-30	11:53:29	0	0	0	1	0	0	0	0	0	0	0	0	1	2	0	0	На сайте размещен Бюллетень Счетной палаты Российской Федерации № 12 (156) за 2010 год http://www.ach.gov.ru/ru/bulletin/562/ 	Российской Федерацией
<ach_gov_ru>	2010-12-30	17:27:57	0	0	0	0	0	1	0	1	0	0	0	0	1	2	0	0	С.В.Степашин: В уходящем году мы выявили финансовых нарушений на 560 млрд рублей http://www.vesti.ru/doc.html?id=418021 
<ach_gov_ru>	2010-12-30	17:31:47	0	0	0	0	0	0	0	0	0	0	0	0	0	0	0	0	С.В.Степашин: Мы впервые очень серьезно начали заниматься аудитом эффективности, стратегическим аудитом. 
<ach_gov_ru>	2010-12-30	17:32:03	0	0	0	0	0	0	0	0	0	0	1	0	0	1	0	0	С.В.Степашин: Не просто считать деньги, а давать экономическую, финансовую оценку деятельности правительства. 
<ach_gov_ru>	2010-12-30	17:32:50	0	0	0	1	0	1	2	0	0	0	0	0	0	10	0	0	С.В.Степашин: И надо отдать должное Владимиру Владимировичу: он ни разу не переживал на предмет того, не вторгаемся ли мы в его компетенцию. 	Владимиру
<ach_gov_ru>	2010-12-30	19:24:44	0	0	0	0	1	0	0	0	0	0	0	0	0	2	0	0	Видео YouTube добавлено мной в избранное -- 2010 год: финан... http://youtu.be/mCdo9-4SAN0?a 
<ach_gov_ru>	2011-01-11	14:13:57	0	0	0	0	0	0	0	0	0	0	1	0	0	0	0	0	СП РФ рассмотрела результаты контрольного мероприятия «Стратегический аудит эффективности госрегулирования рынка зерна http://goo.gl/l1r5b 
<ach_gov_ru>	2011-01-11	14:14:50	0	0	0	0	0	0	0	0	0	0	0	0	0	0	0	0	СП РФ рассмотрела результаты контрольного мероприятия «Проверка финансово-хозяйственной деятельности «Сахалинское морское пароходство». 
<ach_gov_ru>	2011-01-11	14:15:26	0	0	0	0	0	0	0	0	0	0	0	0	0	0	0	0	ПОДРОБНЕЕ http://www.ach.gov.ru/ru/news/11012011-1/ 
<ach_gov_ru>	2011-01-11	22:30:14	0	0	0	2	0	0	0	0	0	0	0	0	1	0	0	0	12 января делегация Счетной палаты Российской Федерации посетит Республику Абхазия. 	Российской Федерацией	Абхазия
<ach_gov_ru>	2011-01-11	22:32:28	0	0	0	1	0	0	0	0	0	0	0	0	0	4	0	0	О борьбе с коррупцией в России шла речь на встрече Президента с главой Счетной палаты. Сергей Степашин сообщил, что http://goo.gl/Q7Ldt 	России
<ach_gov_ru>	2011-01-12	15:13:56	0	0	0	1	0	0	0	0	0	0	0	1	2	1	0	0	Вчера, 11 января с.г. Президент России Д.А.Медведев встретился (cont) http://tl.gd/83e3mj 	России
<ach_gov_ru>	2011-01-12	15:15:03	0	0	0	0	0	0	0	0	0	0	0	0	0	1	0	0	Сегодня Председатель СП РФ С.В.Степашин принял участие в (cont) http://tl.gd/83e4al 
<ach_gov_ru>	2011-01-12	15:16:18	0	0	0	0	0	0	0	0	0	0	0	0	0	1	0	0	Коллегия СП РФ под председательством С.В.Степашина (cont) http://tl.gd/83e50d 
<ach_gov_ru>	2011-01-12	15:17:24	0	0	0	0	0	0	0	0	0	0	0	0	0	1	0	0	Коллегия СП РФ под председательством С.В.Степашина (cont) http://tl.gd/83e5ji 
<ach_gov_ru>	2011-01-13	13:24:55	0	0	0	0	0	0	0	0	0	0	0	0	0	1	0	0	Современное состояние окружающей среды характеризуется крупномасштабным загрязнением атмосферного воздуха, почв и воды http://goo.gl/6kvc0 
<ach_gov_ru>	2011-01-13	13:28:18	0	1	0	0	0	0	0	0	0	0	1	0	0	2	0	0	Установленный законом порядок в сфере пенсионных накоплений определяет приоритет интересов компаний без учета интересов застрахованных лиц. 
<ach_gov_ru>	2011-01-13	13:28:34	0	0	0	0	0	0	0	0	0	0	0	0	0	0	0	0	ПОДРОБНЕЕ http://www.ach.gov.ru/ru/news/13012011-1/ 
<ach_gov_ru>	2011-01-14	14:05:30	1	0	0	0	0	0	0	1	0	0	0	0	0	5	0	0	С.В.Степашин: Какой прок от роста ВВП, если плоды пожинает лишь четверть населения, а остальные испытывают шок от вида гречки по 80 рублей. 
<ach_gov_ru>	2011-01-14	14:05:46	0	0	0	0	0	0	0	0	0	0	0	0	0	0	0	0	ПОДРОБНЕЕ: http://www.rg.ru/2011/01/13/stepashin.html 
<ach_gov_ru>	2011-01-16	13:53:00	0	0	0	0	0	0	0	0	0	0	0	0	0	4	0	0	Уроки "ледяного дождя". Кто и за что при подключении электричества вымогает взятки? Как должны сработать кратные штрафы за взятки? 
<ach_gov_ru>	2011-01-16	13:53:38	0	0	0	0	0	0	0	0	0	0	0	0	0	2	0	0	Об этом председатель Счетной палаты РФ Сергей Степашин в интервью программе "Вести в субботу" http://www.vesti.ru/only_video.html?vid=315235 
<ach_gov_ru>	2011-01-17	11:32:42	0	0	0	0	0	0	0	0	0	0	0	0	0	2	0	0	I uploaded a YouTube video -- Счет за неделю (10.12.2010 - 13.01.2011) http://youtu.be/gR3PGWTns7g?a 
<ach_gov_ru>	2011-01-17	18:46:34	0	0	0	0	0	0	0	0	0	0	1	0	0	2	0	0	СП РФ проверила организацию таможенного контроля при помещении товаров под таможенный режим временного ввоза. 
<ach_gov_ru>	2011-01-17	18:47:03	0	0	0	0	0	0	0	0	0	0	0	0	0	0	0	0	ПОДРОБНЕЕ http://www.ach.gov.ru/ru/news/17012011/ 
<ach_gov_ru>	2011-01-17	18:47:53	0	0	0	2	0	0	0	0	0	0	0	0	0	4	0	0	СП РФ приступает к проверке использования бюджетных средств для организации воздушных перевозок в аэропортах Шереметьево и Домодедово. 	Шереметьево	Домодедово
<ach_gov_ru>	2011-01-17	18:48:08	0	0	0	0	0	0	0	0	0	0	0	0	0	0	0	0	ПОДРОБНЕЕ http://www.ach.gov.ru/ru/news/17012011-1/ 
<ach_gov_ru>	2011-01-18	11:19:02	0	0	0	0	0	0	0	0	0	0	0	0	0	1	0	0	Всем заинтересованным организациям и лицам: Всероссийский форум-выставка "Госзаказ-2011". Официальный сайт http://www.forum-goszakaz.ru/ 
<ach_gov_ru>	2011-01-18	11:38:25	0	0	0	0	0	0	0	0	0	0	0	0	0	1	0	0	Председатель СП РФ С.В.Степашин в составе российской делегации, сопровождающей Президента Д.А.Медведева посетит Палестинскую автономию. 
<ach_gov_ru>	2011-01-18	12:57:48	0	0	0	1	0	0	0	0	0	0	0	0	0	2	0	0	Система государственного мониторинга наркоситуации в Российской Федерации не достаточно совершенна http://www.ach.gov.ru/ru/news/18012011/ 	Российской Федерацией
<ach_gov_ru>	2011-01-19	14:17:02	0	0	0	1	0	0	0	0	0	0	0	0	1	1	0	0	Опубликован бюллетень Счетной палаты Российской Федерации № 1 (157) за 2011 г. http://www.ach.gov.ru/ru/bulletin/563/ 	Российской Федерацией
<ach_gov_ru>	2011-01-20	13:34:20	0	0	0	1	0	0	0	0	0	0	0	0	0	2	0	0	Опубликован отчет о результатах проверки использования бюджетных средств на оказание финансовой помощи Республике Абхазия. 	Абхазия
<ach_gov_ru>	2011-01-20	13:34:51	0	0	0	0	0	0	0	0	0	0	0	0	0	2	0	0	Такое случается не часто, поэтому ПОДРОБНЕЕ: http://www.ach.gov.ru/userfiles/loadfiles/Report_Abhaziya_2010.pdf 
<ach_gov_ru>	2011-01-20	17:22:23	0	0	1	1	0	1	0	0	0	0	0	0	0	2	0	0	С.В.Степашин: По просьбе Сергея Семеновича и руководства ВТБ мы приостановили проверку Банка Москвы. 	Москвы
<ach_gov_ru>	2011-01-20	17:23:09	0	0	1	0	0	0	0	0	0	0	0	0	0	6	0	0	С.В.Степашин: Потому что идет процесс, связанный с возможным включением этого банка в ВТБ, с тем, чтобы не мешать этому процессу. 
<ach_gov_ru>	2011-01-20	17:23:56	1	0	0	0	0	0	0	0	0	0	0	0	0	7	0	0	С.В.Степашин: С тем, чтобы не пугать тех, кто имеет там вклады, юридические и физические лица. 
<ach_gov_ru>	2011-01-20	17:24:22	0	0	0	1	0	0	0	0	0	0	0	0	0	2	0	0	Руководитель Счетной палаты Российской Федерации пояснил, что проверка может быть возобновлена впоследствии. 	Российской Федерацией
<ach_gov_ru>	2011-01-21	11:06:04	0	0	0	1	0	0	0	0	0	0	0	0	1	2	0	0	Государственная дума России рассмотрит вопрос о назначении С.В.Степашина на новый срок на пленарном заседании 26 января. 	России
<ach_gov_ru>	2011-01-21	11:14:59	0	0	0	0	0	0	0	0	0	0	0	0	0	0	0	0	Ю.В.Васильев: Счетная палата стала важным государственным инструментом, способным минимизировать коррупционные риски. 
<ach_gov_ru>	2011-01-21	12:20:58	0	0	0	0	0	0	0	0	0	0	0	0	0	0	0	0	I uploaded a YouTube video -- Счет 44 http://youtu.be/c1B_NYlzvX8?a 
<ach_gov_ru>	2011-01-21	15:34:55	0	0	0	1	0	0	0	0	0	0	1	0	0	2	0	0	СП РФ заключила соглашение с ДОСААФ-Добровольным обществом содействия армии, авиации и флоту России http://www.ach.gov.ru/ru/news/21012011/ 	России
<ach_gov_ru>	2011-01-21	17:56:45	0	0	0	1	0	0	0	0	0	0	0	0	0	1	0	0	Коллегия Счетной палаты Российской Федерации под (cont) http://tl.gd/89qbgf 	Российской Федерацией
<ach_gov_ru>	2011-01-23	13:17:54	0	0	0	0	0	0	0	0	0	0	0	0	0	2	0	0	Заключение Соглашения о сотрудничестве с ДОСААФ http://www.ach.gov.ru/ru/gallery/2011/2011-01-21/ 
<ach_gov_ru>	2011-01-23	13:19:20	0	0	0	1	0	0	0	0	0	0	0	0	0	1	0	0	Коллегия Счетной палаты Российской Федерации под (cont) http://tl.gd/8b1img 	Российской Федерацией
<ach_gov_ru>	2011-01-24	18:54:10	0	0	0	0	0	0	0	0	0	0	0	0	0	0	0	0	Утверждена единая программа контрольного мероприятия: (cont) http://tl.gd/8bufjg 
<ach_gov_ru>	2011-01-24	18:57:07	0	0	0	0	0	0	0	0	0	0	0	0	2	3	0	0	Уточнения для газеты "КоммерсантЪ". 19 января с.г. в газете (cont) http://tl.gd/8buhrg 
<ach_gov_ru>	2011-01-25	13:36:47	0	0	0	0	0	0	0	0	0	0	0	0	0	1	0	0	Коллегия СП РФ рассмотрела результаты проверки финансово-хозяйственной деятельности ГК Агентство по страхованию вкладов http://goo.gl/nks6L 
<ach_gov_ru>	2011-01-26	10:27:17	0	0	0	0	0	0	0	0	0	0	0	0	0	1	0	0	Сегодня Государственная дума РФ на своем заседании (cont) http://tl.gd/8d29ke 
<ach_gov_ru>	2011-01-26	12:25:07	0	0	0	0	0	0	0	0	0	0	1	0	1	3	0	0	Прямо сейчас С.В.Степашин представляет Государственной думе доклад о работе СП РФ за 2010 год. 
<ach_gov_ru>	2011-01-26	13:10:48	0	0	1	0	0	0	0	0	0	0	0	0	0	1	0	0	Фракция КПРФ будет голосовать "ЗА" назначение С.В.Степашина на должность Председателя СП РФ. 
<ach_gov_ru>	2011-01-26	13:14:17	0	0	1	0	0	0	0	0	0	0	0	0	0	1	0	0	Фракция ЛДПР будет голосовать "ЗА" назначение С.В.Степашина на должность Председателя СП РФ. 
<ach_gov_ru>	2011-01-26	13:14:51	0	0	0	0	0	0	0	0	0	0	0	0	0	1	0	0	Фракция "Справедливая Россия" будет голосовать "ЗА" назначение С.В.Степашина на должность Председателя СП РФ. 
<ach_gov_ru>	2011-01-26	13:16:43	1	0	0	0	0	0	0	0	0	0	0	0	0	1	0	0	О.Г.Дмитриева: Счетная палата поднимает и анализирует ключевые вопросы и проблемы расходования бюджетных средств. 
<ach_gov_ru>	2011-01-26	17:43:29	0	0	0	0	1	0	0	0	0	0	0	0	0	3	0	0	С.В.Степашин: Надо установить реестр зарплат и не стесняться. Почему госкорпорации себе устанавливают зарплаты, я не понимаю. 
<ach_gov_ru>	2011-01-26	18:08:41	0	0	0	0	0	0	0	0	0	0	1	0	0	3	0	0	С.В.Степашин: Давайте внесем в КоАП изменения, где дадим право Счетной палате налагать штрафы на проверяемые организации. 
<ach_gov_ru>	2011-01-26	18:11:46	0	0	0	0	0	0	0	0	0	0	0	0	0	2	0	0	449 голосами "ЗА" (99,8%) Государственная дума РФ проголосовала за переназначение С.В.Степашина на должность Председателя Счетной палаты. 
<ach_gov_ru>	2011-01-26	18:13:12	0	0	0	0	0	0	0	0	0	0	2	0	1	5	0	0	Такое же единодушие проявили депутаты парламента при голосовании за проект Отчета о работе Счетной палаты за 2010 год. 
<ach_gov_ru>	2011-01-26	21:52:37	0	0	0	0	0	0	0	0	0	0	0	0	0	6	1	0	RT @RichmondRussia: @ach_gov_ru Мои поздравления вам Сергей Владимирович. Уверен, что вы, как и прежде будете стоять на страже государственного имущества.  ;-) 
<ach_gov_ru>	2011-01-26	21:52:59	0	1	0	0	0	0	0	0	0	0	0	0	0	2	1	0	RT @v_votchitsev: @ach_gov_ru Отлично! Редкий случай безусловного доверия к личности и ведомству :) 
<ach_gov_ru>	2011-01-26	21:53:06	0	0	0	0	0	0	0	0	0	0	0	0	0	1	1	0	RT @ANKryachko: @ach_gov_ru Респект и уважение! 
<ach_gov_ru>	2011-01-26	21:53:28	0	0	0	0	0	0	0	0	0	0	0	0	0	0	1	0	RT @SROGarant: @ach_gov_ru Достойная оценка итогов деятельности СП РФ! С.В.Степашина поздравляем! 
<ach_gov_ru>	2011-01-27	10:19:39	0	1	0	0	0	0	0	0	0	0	0	0	0	6	1	0	RT @Novikov_Live: @ach_gov_ru  Сергей Владимирович, удачи вам!!! Уверен, что вы, как и прежде будете стоять на страже государственного имущества. 
<ach_gov_ru>	2011-01-27	11:12:02	0	0	0	0	0	0	0	0	0	0	0	0	1	2	0	0	I uploaded a YouTube video -- Отчет о работе Счетной палаты в 2010 году http://youtu.be/9Q4n7YIi6hs?a 
<ach_gov_ru>	2011-01-27	15:12:34	0	0	1	0	0	0	0	0	0	0	0	0	1	4	0	0	Тезисы к выступлению С.В.Степашина на пленарном заседании Госдумы о работе СП РФ в 2010 году http://www.ach.gov.ru/ru/2011-01-26-1111/ 
<ach_gov_ru>	2011-01-28	15:54:41	0	0	0	0	0	0	0	0	0	0	0	0	0	1	0	0	Коллегия СП РФ под председательством С.В.Степашина утвердила (cont) http://tl.gd/8ejvvq 
<ach_gov_ru>	2011-01-31	15:31:40	0	0	0	0	0	0	0	0	0	0	0	0	0	1	0	0	Признаков преднамеренного (фиктивного) банкротства проверкой не установлено http://www.ach.gov.ru/ru/news/31012011/ 
<ach_gov_ru>	2011-01-31	16:20:49	0	0	0	0	0	0	0	0	0	0	1	0	0	4	0	0	Председатель СП РФ С.В.Степашин, на встрече с В.В.Путиным, предложил Правительству перейти от системы госзакупок к госконтрактам. 
<ach_gov_ru>	2011-01-31	16:24:23	0	0	0	1	0	0	0	0	0	0	1	0	1	6	0	0	Только за счет контрактной системы в США экономия на закупке военной техники и вооружений - $60 млрд в год. 	США
<ach_gov_ru>	2011-01-31	16:28:16	0	0	0	0	0	0	0	0	0	0	0	0	1	5	0	0	Этой темой СП занимается уже год совместно с Минэкономразвития и ФАС и готово включиться в работу группы первого вице-премьера И.И.Шувалова. 
<ach_gov_ru>	2011-01-31	18:47:32	0	0	0	0	0	0	0	0	0	0	0	0	0	1	0	0	С.В.Степашин принял Чрезвычайного и Полномочного Посла Йеменской Республики http://www.ach.gov.ru/ru/news/31012011-3/ 
<ach_gov_ru>	2011-01-31	18:48:30	0	0	0	0	0	0	0	0	0	0	0	0	0	3	0	0	Заместитель Председателя СП РФ В.П.Горегляд принял участие в заседании Комиссии Совета Федерации по взаимодействию со Счетной палатой. 
<ach_gov_ru>	2011-01-31	18:50:09	0	0	0	0	0	0	0	0	0	0	0	0	0	0	0	0	ПОДРОБНЕЕ http://www.ach.gov.ru/ru/news/31012011-1/ 
